Text,True Sentiment,transformers Sentiment,transformers Confidence,transformers Response Time (s)
think definitely writing quality beginner students english language model conversations dialogue example exchange paul kerseybronson ms kathryn davisdeborah raffin character later extremely clear point ms davis says hope like chicken thing know make kersey deftly responds chickens good like chicken thats english grammar dont know isbr br another thing ms davis character kersey sleeps second date practically throws tells wants see one last timethis fourth time theyve ever met moves sisters house binghamtonny get away creeps really doesnt even bat eye corpse burning street minutes later kersey never even says first name entirety film never get katy thats nice dress wearing kathryn careful katie creepsll get yabr br love developing two frakergavan oherlihy keeps everwatchful eyes almost kersey using bait get fraker much uses camera car sure enough fraker bites kersey bites back hardin incredible sequence events ever caught film final fifteen minutes possibly rivaled final thirty minutes delta force brilliance thats giving delta force lot credit film see ed lauter take alex winter order get charles bronsons back troubled gang leader seemingly calling hotline summon neonazi bikers come aid nimble broadway dancers wearing mesh haltertops posing street punks laid soundtrack written none jimmy page thats highest high comedy nothing funnybr br truthfully speaking thousand ways state unintentional comedy death wish way truly understand watch judge,positive,negative,0.9933918118476868,0.40668797492980957
im wondering watching film producers movie get save money sandra bullocks wardrobe dragging clothes miss congeniality ms bullock also get sleepwalk role channeling gracie hart many reviewers noted film formulaic add deja vu viewer experiences character cassie maywether somewhat darker gracie hart back story rapidly become snooze festbr br two bad boy serial killers done better films good guy partner trying protect partner despite evidence character seen fact none characters film ever get beyond two dimensions try anything trite stereotypesbr br one last peeve using term serial killer false advertising murdering one person even premeditated murder make serial killer may potential become serial killer serial killer even spree killer,negative,negative,0.9982566237449646,0.16669416427612305
imagine real hitler master propaganda speech would mumbling moron carlyle portrayed filmbr br nobody would followed even desperate unemployed guy sbr br hollywood cardboard piece propaganda disguised true historybr br pity everyone actually believed anything show carlyle producers didnt get anything right thisbr br hitler able win many people whole county ideas sausage people follow death portraying loser make film totally unbelievable film mixture old ww propaganda mtv urban myths one important persons last century imagine film churchill director shows drunkard mins br br film disgrace wonder could talk actor like carlyle dreck,negative,negative,0.9976457953453064,0.28209757804870605
idea audience director george schlatter hoped sell comedyofills redd foxx central role enough pimpy outfits polyester carpet entire norman plays like blaxploitation picture combined number silly sitcom episodes involving comic misunderstandings mention elongated cameo waylon flowers based play sam bobrick ron clark tale estranged married couple foxx pearl bailey learning hard way son secretly gayand living mincing prancing white homosexualhas enough limpwristed jokes shame early episode threes company bailey keeps dignity foxxs sheer confusion good couple chuckles rest performers humiliated,negative,negative,0.9959321618080139,0.3126697540283203
one last films directed lionel barrymore ten cents dance stars barbara stanwyck dancehall girl barbara sixth role stanwyck looks quite plainjane one opens getting chewed dance hall manager along comes rich guy bradley carlton ricardo cortez wants sweep feet cortez stanwyck made three films together meets eddie whos different dashing carlton writer jo swerling worked biggies wonderful life guys dolls gone wind surprised characters script ordinary story starts getting interesting halfway thru similar bride walks also starring stanwyck tbwo much clever also tame due onslaught hays code,positive,positive,0.7258853316307068,0.20389747619628906
one great movies time story fascinating actors convincing really identify characters william wyler proofs movie great director craftsmanship unsurpassed,positive,positive,0.9986656904220581,0.056036949157714844
dear god kept waiting movie get started waited redeem neither sat dumbfounded could possibly bad wasted couple hours sheer stupidity faith drew couldnt possibly made bad movie boy ever lose faith dont bother one drew tried movie poorly written poorly acted poorly conceived cant believe script bad ever got funded million chances actually something idea word concept big movie even qualify still didnt go anyplace pitiful reviewer got idea wasnt worst baffles believe got worse id slit wrists finishing,negative,negative,0.9992114305496216,0.1358017921447754
ed coincidentally editor hired cut horror films favorable europe standards much rigorous finds films minddestroying starts going little bit mad okay little bit might understatementbr br let say first best opening scene ever man office blows head grenade boss says straight face youre fired entire film keep level intensity certainly triesbr br take shotgun scenes decapitation clips lost limbs friend jason wishes real film writer film thought idea woman gets raped beaver immediately gets shot face bazooka something wont find movie least im pretty doubtful willbr br films biggest flaw quality picture isnt crisp film sound could touched though bad thought watching film although gave bit boost mind film also style writing directing sense fun giving audience little something extra top miss daysbr br wish say though moment think anything strong enough praise film think ought see youve seen box video store ax splitting head maybe youve passed times maybe thought would cheesy pick savor,positive,negative,0.9838878512382507,0.2400979995727539
sydney lumet hasnt box office hit years yet managed churn tight wellcast suspenseful thriller set old stamping ground new york city got insurance let alone budget flops mystery also story pretty grim one characters particularly likable held edge seat till final scenebr br two brothers pressing financial problems conspire rob suburban jewelry store owned elderly parents victim going insurance company robbery goes awry two people die film concerned aftermath action nonlinear seen main characters differing points view difficult follow easy work back story brothers get mess clues younger brother baby family fathers favorite older brother seems carrying lot baggage relationship father vice versa hardly accounts becoming heroinusing murdering embezzlerbr br scheming older brother corpulent philip seymour hoffman dominates film well supported ethan hawke bullied inadequate younger brother albert finney father seems constant state rage script calls marisa tomei older brothers cheating wife age puts sexiest performance ive seen many year film literally starts bang comfort zone pretty quicklybr br dont know origins story first time scriptwriter kelly masterton suspect like lumets great film dog day afternoon based fact silly untrue lumet last immensely versatile oldtime craftsman studio directors immense speed able direct anything put front great films produced way well classic turkeys isnt classic either sort wellcrafted piece downbeat entertainment probably leave feeling lucky member family dysfunctional one still wondering got way know parents happy see little mother hear little impossible pick relationship boys also daughter whose presence seems redundant well like tolstoy conclude unhappy family unhappy way,positive,negative,0.9579925537109375,0.566939115524292
owes great deal plot captains courageous although quite grown partly story wealthy lad shanghaied crew member aboard cargo vessel becomes man process moran title boyish young woman also brought vessel owned father cargo burns crew members evacuated lads ship however captain smuggling mind intentions honorable moran concerned inevitable ensues lad falls mannish moran end evil subdued lovers united interesting dialogue points moran belongs man woman nod sappho dorothy dalton appropriately sexless moran attractive either valentino well romantic action role sexy build physique shown advantage role quite masculine one appealing great film passes time really showcases valentinos beauty sexiness,negative,positive,0.9970261454582214,0.17398715019226074
perfect double bill horribly corny beverly hillbillies equally atrocious lame brained comedy son law country girl rebecca goes wild california attend college assaulted lifestyle resident adviser crawl helps settle soon two good friends bec decides bring wacky crawl home thanksgiving obvious fish water resultsbr br comic angle steve rash aptly named achieves sexual one bludgeons us avail comic aspects fail dismally know film groping crawl hijacks combine harvester writes name corn fieldbr br dramatically movie falls short several attempts family personal counselling crawl misfiring pauly shore carla gugino manage raise couple smiles little else rest cast mere fodder problem nearly impossible actually like crawl youll find spending whole flick wondering rebecca would want spend moment however youre fan unintelligent comedy son law right markbr br sunday november tv,negative,negative,0.998377799987793,0.2241957187652588
thought movie watched pluto nashwhybecause movies randy quaid playing retarded robot movie made years earlier probably written screenplay writer drank biotoxic coffee something like thatwhoaavoid costs even pay tribute late great andy kaufman hard herefind another film watch taxi reruns latenight tvhis latka gravas character much loveabletank berry much,negative,negative,0.9957923889160156,0.11376404762268066
watch sad excuse film wasted time money pretty psed itbr br acting comparable high school plays script shocking plot twenty minutes end believe rewarded reaching headache screaming crying wailing five girls makebr br majority violence rare film nowadays suggested rather graphically depicted found characters damn irritating wanted see indeed every single person involved making piece st die horrible ways possiblebr br spend ten minutes life saving poor minutes dont,negative,negative,0.9989689588546753,0.1119844913482666
movie good premise start suspense slashers secret society really couldnt figure bad guys last quarter moviebr br contained many dumb clichs worst old american slasherhorror movies love slasherhorror movies old clichs long disappeared american cinema example old hear noises basement im home alone basement light doesnt work ill go investigate clichbr br three examples clichs really irked end br br potente finds may secret society work medical school carving live bodies proceeds ask questions tell everyone publicly essence saying found come kill telling everyone secret wonders finds blood smeared bed brought roommates severed finger towelbr br even one guy met two weeks ago ends dissection table finds secret society disemboweling live people goes lab dead bodies stored times night investigatebr br roommate gets killed gets chased killer knows doesnt report university police leaves school go home visit parents returns school apparently thinking guy tried kill let bygones bygones try kill even though knows secret course wrongbr br someone supposed smart studying doctor best school germany acted like clich bimbo horror moviebr br things made potentially good movie frustrating made wish ending would come even sooner halfway movie stopped routing wished would end dissection table,negative,negative,0.9987536668777466,0.5039927959442139
first rented batman returns immediately thought going less exceptional mean jack nicholson undoubtedly best part first without could good movie simple throw danny devitobr br batman returns arguably dark movie batman villains less actual dark comedy lot aspects nervestriking issues however music similar first darker scenery definitely depressing first every detail right time year movie follows comicstyle format came love first batmanbr br performances michael keaton thankfully returns batmanbruce wayne great first movie much sequel enough screen time world keaton batman need danny devito gave awardwinning performance penguin grueling disgusting lovable angry evil sad pathetic villain ever grace superhero movie hate much yet feel bad time explains last detail making conflicting michelle pfeiffer excellent catwomanselina kyle two completely different personalities one actually got good amount back story well christopher walken didnt disappoint max shreck greedy judgmental selfish ceo power company michael gough also thankfully returns lovable alfred good well pat hingle also returns gordon although feel really never spotlightbr br lots great twists subplots batman returns sure please fan originalbr br,positive,negative,0.9791926145553589,0.4379844665527344
film mediocre best angie harmon funny bag hammers bitchy demeanor law order carries failed attempt comedy charlie sheen one come unscathed horrible anticomedy positive thing come mess charlie denises marriage hopefully effort produces better results,negative,negative,0.995011568069458,0.14461112022399902
typical romp cheech chongs reality includes drugs singing drugs cars driving even drugs pee wee aliens gasoline laundry stand comedy surprisingly drugs space coke coherent plausible smoke still incredibly funny without becoming strange nice dreams classic scenes include opening scene get gas car drive work also funny cheechs song mexicanamericans chongs follow song another notable scene welfare office scene jones human noise machine police academy series old laughing man great follow smoke quite watchable sober notbr br celluloid rehab,positive,positive,0.9372243881225586,0.16675829887390137
gripe opera dont quibble film cabaret original show either films musicalsoperas adaptations dont work cabaret took liberties original show film porgy bess yet kept original integrity reworking material judged artistic success holds true porgy bess reworked opera dialoguesong libretto audiences time loved musicals stayed away echt filmed operas would economical suicide preminger produce film opera would lost fortune goldwyn studiosbr br said fine adaptation acting excellent oscar winning scoring andre previn magnificent choral singing individual vocal achievements incredible robert mcferrin dad popular musician bobby mcferrin dubbed porgy adele addison dubbed bess sammy davis jr sang songs film recording contract would permit voice heard soundtrack album cab calloway recorded numbers spectacularly release brock peters bassbaritone extraordinary pearl bailey unique self diahann carroll although singer fine note small role clara required high soprano old reliable marni nixon dubbed singingbr br gershwin estate hates film refuses grant musical rights although dramatic rights public domain sort hate feud held video release carousel almost fifteen years although case dramatic rights litigation currently preventing porgy bess annie get gun released videobr br stage productions given film versions latter two sole holdouts video campaign letters gershwin estate ny might loosen reserve,negative,negative,0.6343148946762085,0.2922208309173584
first worst movie ive ever seen may make want see bad good way boring implausible poorly shot ridiculously scripted lacking cool disaster effectsbr br worse intensely patriotic without trace irony fun wallowing sense japanese uniqueness victimhood everyone abandons japanese hour need particularly koreans noble characters choose seppaku going ship beloved island sinks japanese would think way says prime ministerbr br movie way reflects japanese opinion place world opinion first thing rectify problem stop making movies like,negative,negative,0.9988964796066284,0.27504968643188477
saw dvd apartment paris exchange program laughed hard cuz much going movie happened us mean yeah sure pretty clichd still true know im sayingbr br think related quiet guy italian xavier im observer group anyway wish hot roommate like cecile de france seems like cool chick movie real saw hosting cannes festival last monthbr br im thinking wan na go barcelona next summer seeing movie got ta check sequel came france,positive,negative,0.9569079279899597,0.15185046195983887
actually saw movie read book saw movie upset wondered dean koontz made bad bookmovie movie confusing didnt flow choppy made want throw rock tv couldnt connect characters didnt care happened themnormally love characters relate personality problems read book loved often reread book movie collecting dust wish someone would make koontz movie follows plot books movies wouldnt suck much watch movie unless need waste money,negative,negative,0.9985236525535583,0.11539101600646973
anything else earth enticing learn expects frail bodies um death spanish director ignacio cerd soulmate german colleague jrg buttgereit provides blowbyblow answer curiosity invites us exciting journey world preparation tables scalpels surgical saws human entrails warped mindsbr br welcome autopsy roombr br dont know facets film apart notorious reputation may helped acquire sufficiently high ratingbr br storywise fairly simple straightforward day life actually half hour troubled coroner perhaps assistant pathologist whoever fed routine morbid duty discharges psychological tension nontraditional fashion right workplace im perplexed particular message authors tried deliver onenote plot suspect may somehow inspired udo kiers characters quirky demeanor andy warhols frankensteinbr br artistic values film also questionable hard evaluate performance actors dont squeeze single word emotions concealed behind medical masks theres also enough room great camerawork basically entire action unfolds mostly within four wallsbr br authenticity effects makeup impressive setup looks plausible handful medicalforensic experts judge truthful anatomically correct dissection carried anyone cares honestly used think autopsy done examine condition particular organs ascertain cause death know dead bodies severed raped humiliated intestines ripped apart brains retrieved head stuffed abdomen mixed guts body stitched back washed nothing personal poor lads expected write deceitful autopsy reports afterwardbr br shock disgust factor much unlikely unsuspecting viewer would discover horror disc intended watch wife kids beside christmas tree turns graphic video manual vivisection obscure item barely available sought people well familiar subject easily offended hence would pointless warn anyone sabotage film well aware exactly watching want seebr br cerd really gifted stylish director clearly obvious least two parts trilogy preceding awakening amazing black white short minute genesis visually stunning moody piece offbeat interesting concept im pretty sure one day conquer hearts moviegoers new mainstream oriented material sooner later aftermath would become rarity meticulous collectors early warmup worksbr br meantime im afraid may recommended strictly medical students specialists study mental disorders sexual deviations,negative,negative,0.9737623333930969,0.849156379699707
misguided miscast murky interminable lunacy given highgloss mgm abudget treatment kate hepburn plays bride comes suspect rich handsome husband robert tayloris dreamboat married psychotic killer mgms attempt hitchcockian thriller doomed start turgid muddled ludicrous script idiotic casting hepburn jeopardized woman fearing life could ever imagine hepburn afraid anything louis b mayer forgot tell vincent minnelli directing thriller musical taylor embarrassing robert mitchum also castagainsttype good guy retains dignity quiet lowkeyed performance karl freunds ravishing cinematography creates images eerie beautyand wasted wrong film end result metros parnell,negative,negative,0.9938077330589294,0.24052023887634277
film outstanding date apr demand show time since seen feature thomas jane first role seen first see normal guy seems kind henpecked wife seems close going way directors cut watched opening scene cool paulina porizkova dressed cheerleader type looking fresh hot trying buy coffee late night small bills turns violent hurry paulina shows name letter jacket real deal meeting old road pal nick played aaron eckhart cool first even loans wifes car take care business spots nicks silver briefcase day changes weird violent cast real characters parade next series scenes paulinas dallas steals show think telling casey story doctor get personal interview adoption application outrageous rule never thought tall women sexybut rule exceptions paulina one never seen films sexy lethal like one movie tom selleck never seen malevolence looking film add collection one worth price paulina nude worth price alone story everything one might hope one lovefriendshipsex violence terrific mix first seen years ago blew mind know feel way,positive,negative,0.8147754669189453,0.4267120361328125
interaction portman sarandon quite interesting really sold motherdaughter relationship family story isnt dulled frills special effects story really couldnt help give sigh end movie alas well told bittersweet tale growing relating family friends acting quite exquisite hope well seeing portman sarandon familiar roles road,positive,positive,0.9963861703872681,0.15583014488220215
well say nymphomania leaves unsatisfied dont know stella james sean young qualifies clinical nymphomaniac certainly sexual relations men shes still exploring trying find data see wants life men though seems like age pretty good idea cant agree however anyone says young old role age nicely part film left cold though means worst type youll ever see unlike recent eyes wide shut least something happens one,negative,negative,0.967011034488678,0.21283459663391113
still dont know hell movie going mean really movie demonstrating sean connerys complete lack arabic showing could play role moroccan warlord natural play role ramirez highlander teddy roosevelt even movie much sand put little use much table slapping teddy ignore japanese guy shooting archery realize man japanese credible excuse given connerys accent least jean claude van damme excuse french accent whether raised french nuns hong kong double impact raised bayou louisiana universal soldier french mother raised indochina even remember name movie anyone explain,negative,negative,0.9985596537590027,0.14686131477355957
movie lot fun ive seen couple times always something funny remember duckies bunnies car scene one favorites still quote morones versions certain wordsbr br many running jokes amazing love michael keaton anyhow,positive,positive,0.9970058798789978,0.09867095947265625
one best fred astaireginger rogers films least one favorites ar movies feature great dancing sappy romance stories still courtship corniness pronounced filmsbr br movie features great dancing likable characters bunch good songs music central theme whats nice addition tap solo rogers super dancer pretty woman one tremendous figure dances also fred course theyre always fun pair watch dance floorbr br growing watching ozzie harriet television real kick first time saw see young harriet hilliard surprise ozzie fell beauty although short early hairstyle recognized voice right away also movie quick appearances betty grable lucille ball admit yet ball cant find know shes herebr br astaire except obnoxious gumchewing first third film fun watch randolph scott although better westerns likable toobr br simply nice feelgood film good one want enjoy great talents astaire rogers,positive,positive,0.9971430897712708,0.27432942390441895
ive found movie offensive americans lost somebody towers american people general pretending homage horrible facts happened last years director takes opportunity polemize old facts none terrorist attack criticize americans political behaviour compare different political situation country nothing share atrocity september shame,negative,negative,0.9550369381904602,0.10544991493225098
chance seeing film see quite shocking parts really makes think many important issues didactic opinion piece art beautifully filmed fine music many styles typically impressive level acting one come expect bbc drama nathalie press billed natalie press convincing role depressed teenager exploited male classmate celia imrie beautifully reassuring quality gives sometimes unnerving action stability viewer comfort knowledge someone actually normal real star always timothy spall surely one greatest actors time,positive,positive,0.9997301697731018,0.12301373481750488
constantly mean really right title incredible melting man else would expect admit im sucker anything come across monster hd channel redeeming feature picture would truly grotesque makeup job legendary rick baker creepy ill give nod horny old geezer couple sucking lemons lights truly scarybr br something could never figure horror flicks monsters victims wouldnt simply run away faced virtual annihilation like chick cabin know door completely visible right kitchen could run right time incredible steveo couldnt muster much brisk walk blow right dont know maybe im missing something br br flick feel tales crypt episode tales usually cool grotesque twist often times didnt see coming one picture couldnt quite get handle coming going example early scene clearly make melting mans eyeball fell head manage get around rest story guess supposed askbr br eighty four minutes picture hour half long ready take general perry earlier suggestion could really use drink,negative,negative,0.9980288147926331,0.2486124038696289
