nicolas roegs projects variable say least never less interesting insignificance obviously first foremost adapted stageplay wordy prettymuch roombound pays view film underlying themes overtly presented whats takes adjust juxtaposition rolereversals four protagonists einstein mccarthy munroe dimaggio br br einstein wracked guilt hiroshima yet fancies simplicity sexual liaison munro munro sick seen bimbo craves intellectual credence senator mccarthy height witchhunting powers impotent sleazebag dimaggio insecure celebrity selfobsessed prone violence contains seeds destruction character troubled abusedabusive past questionable future gradually see obsession central theme americas obsession postwar cultural icons mores obsessions protagonists something none peaceofmind andor happinessbr br compared theory relativity proposed unifiedfield theory indeed cosmos aspirations interactions roegs protagonists seem insignificant yet aspects physical universe quantum trust affect us applied development means destroy us monroes mention principle behind neutronbomb without naming anachronism per se understood contemporary audience indeed references within script accessible knowledgeable viewer one au fait occurrencespersonality cults affect us st centurybr br film screenplay either clever extremely opaque pretentious ultimately however probably insignificantbr br live long prosper br br,Positive,negative,-0.919337,0.3469388484954834
kept attention end however without spoiling film anyone fixed fridge getting book library knew film would end went back library book self defence assassin film said nothing worth becoming assassin really remedy mental illness another symptom,Negative,negative,-0.898535,0.3089632987976074
happened catch community tv years back pleasantly surprised enjoyable film wasbr br bit corny certain ways prime function mystery thriller works superbly thanks script concocts ingenious plot kept guessing throughout resolution inspiredbr br cast starstudded one containing mixture end careers indeed richard long died year made verge stardom hit tv series kate jackson tom bosley good job exception cesare danova sleepwalks rolebr br strongly recommended,Positive,positive,0.966047,0.30843329429626465
movie littttle confusing first usually like gina phillips one say bad choice like movie ring around rosie one also one good movies jeepers creepers way better anyway faye dunaway good totally creeped end crazy jennifer cassiphillips comes twin sisters funeral stays house sister owns grandmotherdunaway lives aunt named emma mary ellendunaway kinda sacrificing relations stay alive long wants live cant die even jennifer tries kill tries ravens weird part relations go sleep ravens eat organs cant go sleep basically crazy mary ellen never die relations buried dead bc suffer forever mary ellen stay alive yeah hope helps doesnt sorry love ya,Negative,negative,-0.923317,0.3251311779022217
congratulate genius approved one edward furlong youre good think mate cant grab every piece lowcost amateur crap sole intention get bucksbr br filming bad mean bad anyone camera would get result betterbr br acting lets say dont go supermarket looking actors good ones usually come degree least damn experience director mr jon keeyes please find purpose life director simply suck directing poor angles messed good way lines seem theyre read toilet paper damn music always comes shouldnt goes apparent reason dont go writer either way making movies isnt like serving coffeshop requires art skill things really doubt youll ever havebr br instead making badass shootout movie shouldve shot one back oblivion wait till something good came go find job coffeshop youll less stress youll save movie goers money bad nightbr br vote first one,Negative,negative,-0.933567,0.32619738578796387
im going criticize movie isnt much talk good animal actions scenes probably pretty astonishing time clyde beatty isnt exactly matine idol hes little slight particularly good looking thats ok hes man lion cage know cant take time away lions tend girlfriend end island save day someone said earlier history lesson scenes circus another day especially kids hang around didnt realize even back thirties sailed three masted schooners looked like something guess thats stock footage wonder thing got wrecked theyre always talking fixing theres even dirigible tells us little male female relationships time kind giggly silliness dont take seriously fun watching,Negative,negative,-0.856038,0.32848596572875977
worst movie cat hat gigli mais non propose atrocious little film earlier year badly written badly edited may bold badly acted order black hole film movie dense even slightest bit entertainment could escape event horizon suck isnt even accidentally funny like example showgirlsbr br know producers assuming audience isnt going smart renamed movie originally titled sin eaters figured americans stupid understand sin eater even though go great lengths explain sin eater movie instead figure utterly generic title picture heath ledger looking sullen enough get therebr br hey know right exgirlfriend saw picture heath dragged congratulations producers youve met target market also liked grease ii youre good companybr br back topic heath plays catholic monk specific guessed order trying investigate murder mentor celibacy issues possibly nobody right mind would believe knew slightest thing religion much less celibate monk member order funny alcoholic fat guy much ive wanted see return funny alcoholic big screen attempts humor reminded dorks high school imitations monty python thinking said lines like pythons would automatically funny know sort people im talking aboutbr br utter would danger generating spoilers frankly thing spoiled movie fact created,Negative,negative,-0.997125,0.32814979553222656
significant charisma commanding presence keep afloat fred williamson done far better urban action films including many later vidreleased fare big studios williamson films earlytomid rarely punch midlevel counterparts prime example clumsy action little violence pg rating nowhere near questionable worth look hammer completists case,Negative,negative,-0.85426,0.3288228511810303
stupidest fight scenes time veteran war would cry see movie would remember vietnam poor representation veteran war even though troops carrying ms movie resembles nothing like vietnam viet cong even uniforms look like old leftover japanese uniforms wwii movie setting obviously crappy hollywood back lot worst scene contains us soldier fighting hand hand like bad martial arts movie dispatches several enemy troops says hey come lets kick butt helicopter air shot movie trash,Negative,negative,-0.999919,0.30483317375183105
richard norton really lights screen portland oregon based martial arts masterpiece norton aussie heartthrob plays evil mr milverstead runs successful importexport business smuggling arms participating female flesh trade usually women plucked favorite dance club help squad goons well known bolo yeung playing role ice trouble comes milverstead new cop town john kim britton lee avenge dead partners murder hand milversteads organization time see one martial arts movie year dont miss classic,Positive,negative,-0.793721,0.333848237991333
got worst case acting since silent era one two actors virtually entire cast lee majors bo svenson fine rest look like first time actingbr br budget tremendous much costumes set believable many things jump viewer let us know couldnt double check get props match periodbr br cant think one aspect film liked didnt shake head time better spent burning lint collected bellybutton,Negative,negative,-0.921045,0.29594874382019043
going make movie book sure characters consistant book movie defied biblical story told thousands upon thousands years children one way another clearly took liberties adaptation would probably ever try least lord rings close enough books people understand story read books noahs ark tried,Negative,positive,0.418811,0.3322896957397461
movies heart right place matter brain wasbr br attack basically spoof la airplane two years fact nice going happens vegetables case fruits attackbr br manner film magic stop motion papiermache tomatoes skateboards reverse filming people watching offscreen tomatoes people throwing basketballsized tomatoes onscreen actors tomatoes indeed attack everyone leafy grasp br br mason dixon miller group spies wouldnt wish governments side save day course theres meddling reporter taylor pops worst times dancing singing army soldiers japanese scientists dubbedin voices guy dragging around parachute samurai swordand oh yeah san diego chicken made bigbr br gags arent great fact could probably make better watching dialogue inutterably bad please pass ketchup something say front tomatoes far puberty love goeswell cant blame tomatoes shriveling hearing itbr br whats good well liked theme song beginning credits scene four people phone pretty well executed thats itbr br three stars killer comedy triesbr br rock peace,Negative,negative,-0.760855,0.30094456672668457
america needs best man possible win game hire gymnast oh brother played kurt thomas necessary skills win game involves ninjas village crazies richard norton told kurt thomas keep hardware pants exact words missed theaters good reason would probably kicked due laughing broke regular intervals first thing went mind lame ninjas gymnast kick ass kurt thomas like foot hardly strikes one best man job acting talent kurt thomas well cant say something nice seriousness though one wonder much cocaine used furnish idea stupid decision cast tara reid scientist tops dumbness years though held title dumbest movie ever seen say didnt find unwatchable laughing hard almost choked death twice could movie bad idea get made although record movie ever feature hero wimpy cant even pull wedged sword ground wimpiest action movie ever made one hilarious alsobr br bad,Negative,negative,-0.99846,0.3044312000274658
one better spoil piece work awesome movie written expertly likes ira levin depicted best performance christopher reeves career one caines best simply excellent wish could catch staged version somewheremaybe someday hope grossly underrated overlooked film become difficult locate must hitchcockian agathaphile lover great film one movies couldnt instantly solve predict worth second even third viewing deathtrap gets earns every iota need deserve movies like,Positive,positive,0.396534,0.29634547233581543
remember watching elizabeth montgomery movie maybe years old day remember movie bits pieces movie remembered throughout life sooo scared think remember story part house constantly dark main part freaky elizabeth walking around house dark someone field outside time thought old witch memory way hazy cant really remember someone definitely field outside lurkingand part freaked really wish could see movie anyone knows get copy please email validyahoocom,Positive,negative,-0.998019,0.3163793087005615
hallam foe tells us story boy lost mother experiences sort oedepus complex afterwardbr br something like minutes long would better ten theres like hour middle climbing practice rooftops habits church tower like quasimodo much less sympatheticbr br theres strange love story involved doesnt anything anything happens look like mother yes know misses mother thats first ten minutes put beginning ending together would ok short film portrait character doesnt change guy stuff happens active choice whole middle movie apply jobbr br theres whole oedepus thing going supposed make us analyze character paints face dresses womens clothing wears dead badger head badger youve got see ending returns home badger head shot like tacky horror film kill dads new wife sex beginning somehow thought wouldnt entertaining enough put indie punk music background ive got admit though im kind allergic films want write psychological complex nose feels like mackenzie directorguywhatever trying show us also studying psychology school smart thank bringing forgotten theories back memories really dug wallraff okay realized film based random book anywaybr br photowise boring lot talking heads plus editor changed colors scene scene know cold warm etc maybe hallam foe feature test film color blind people maybe thought drama wouldnt enough tell us feels lonely increased blue really get itbr br im even gon na comment clich indieohhowhowhowcute drawings made presentation cute sex stuff going whole film independent clich recommend laughed times though really annoying film student see crap like gets machine,Negative,negative,-0.963672,0.33045506477355957
poor jane austen ought glad shes around see dreadful wreck adaptation many great jane austen movies come recently one deserves permanently buried along two movies despisethe man gray flannel suit version david copperfield main beef movie completely misses point book jane austen poking fun gothic mania society much novel tongue cheek movie however serious comes across terribly melodramatically lighthearted funpoking flavor austens writing completely conspicuously absent ponderous foray iinto horror meets period drama scenes catherines imagination gratuitous uninteresting also henry tilney dreadfully unappealing ask would anyone fall looking funfilled jane austen evening watch emma instead,Negative,negative,-0.999739,0.30751562118530273
outing certainly doesnt live predecessor share memorable moments personal favorite laying waste city block videodisc cannon see close nimoys face single tear sheds left eye know point nimoy killing machine viewer cant help pulled emotional turmoil understand previously flat affect facade absolute brilliance sex scenes display nice balance carnal pornographic afterwards felt pretty good understanding work magnavision videodisc player bad havent produced years,Negative,negative,-0.582249,0.3574674129486084
looking forward movie since lost world came didnt bother lost world wasnt intellectual original hoping good monster movie dinosaurs eat people however disappointing even levelbr br starters enough people eat ill keep secret many people get eaten enough also shortage variety dinosaur community nearly enough dinosaurs many dinosaurs like spikeybackandhasaclubonitstailosaurus made cameos didnt much considering cool arebr br start spoilers pterodactyls figures ive read put body weight pounds movie made look closer worse didnt get eat anybody even splatter rocks dropping high ending movie either sudden credits end spoilers im left wondering edition saw missing minutes filmbr br conclusion taught pterodactyls stick long beaks stealthily pockets get go rent carnosaur series least wont disappointed,Negative,negative,-0.99726,0.309096097946167
famous french detective henri cassin takes first vacation years st margot meets nanette daughter vacation spot proprietors despite nanette promised childhood sweetheart leon henri nanette fall love decide marry despite nanettes father objecting due henris age day wedding leon returns nanette runs nothing heard two found dead henri swears wont rest find killer clue henri work footprint found leon also getting written warnings others die soon soon nanettes mother found dead henri idea identity killer thinking failure returns paris realizes fears killer one person even though none colleagues believe explanation ordinary murder mystery doesnt really follow formula genre columbia b studios credit certainly goes director lewis manage turn noirish film despite setting film also aided use good camerawork lighting geray turns good performance probably lead rest cast able carry performance rating,Positive,negative,-0.900066,0.34091973304748535
say grown watching hum saath saath hain hum aapke hain koun maine pyar kiya soraj always different movies part lives evolutionary times soraj creates something thats hard find love joint family loving great vivah journey couple getting arrange marriage turns arrange love marriage shahid done fine work anupamji always brilliant amrita rao quit different even though felt someway doesnt suit role weve seen ishk vishk ab ke baras main ho na quit different role isnt excellent main ho na ishk vishk may couldve put little role anyways great going work barjatya movie rejuvenates values forgot sweet film year great music lyrics sure remake anyways brilliant story original sorajs movies brilliant way always expect something different great work cast crew everybody lovely family film enjoy parents siblings friends love ones give,Positive,positive,0.998514,0.31972455978393555
worst movie ever seen movie match quality movies cabin fever even name actors one fell short eye candy movie looked woman bad face lift example quality would rated movie negative possible ladies tell men bad look much either planning going see movie would strongly recommend saving money,Negative,negative,-0.973652,0.30980563163757324
admit approached movie sense expectation dread louis de bernieres bestselling novel one favourites anyone read realise way hell screen adaptation faithful br br way found convincing movie unsuccessful stripped books plot back far render redundant ending however much better novel could stop thinking movie afterwards still plusses john tolls magnificent cinematography stephen warbecks great score etc felt outweigh initial negatives cages miscasting heavily diluted scriptbr br two days later queuing see corelli although perfect admit movie best anyone could expected cage actually brilliant role even de berniere concerned fully rounded character carefree spirit gives way shattered remorse spot complements superb double act penelope cruz john hurt perfectly david morrissey quietly effective weber nazi officer trying reconcile feelings newfound italian friends inbred superiority complex around fine grecoitalian supporting cast bring de bernieres sundrenched world cepholonia dazzlingly alivebr br leaving cinema second time around finally let go passion novel prevented fully appreciating story ww cepholonia cinematic terms hat goes john madden despite almost expected critical drubbing receiving british critics director major success like shakespeare love behind always target moaning ninnieshas managed transfer terrifically difficult book big screen heart verve humanity core virtues novel fact created another classic love story probably fully appreciated dust settled years nowbr br fan book like hard try make mistake initial viewing try erase book mind two hours bathe glorious mediterranean atmosphere discover corelli pelagia mandras dr iannis first time pretend youre watching something made original screenplay guarantee wont disappointed br br fact youll eagerly waiting copy delightful movie video dvdbr br,Positive,negative,-0.503698,0.3526346683502197
twenty minutes movie already bored quite simply characters fairly dull occasionally something enjoyable would happen things would slow fortunately patience eventually rewarded ending movie wasnt bad however means good enough justify sitting first ninety minutes would say movie mediocre overall considering talent cast id call disappointment,Negative,negative,-0.998105,0.33182287216186523
earth family waisted hours life piece rubbish plot tension lot boredom kids could better movies videocamerabr br maybe get point movieoh wait mum one liked following reason least film cars screeching looking warfilm fighting still interesting gripping strong antiwarmessage watch trenchbr br give film good enough afternoonnap nice,Negative,positive,0.698592,0.3038604259490967
full house one worst tv series ever whybecause characters irritating impossible bearthe best character joey even pretty irritating occasionallyan girl djwho wrote characteri want kill self every time speaksnot mention danny starts philosophybr br example dj around ten thousand dollars casinohowevershes eighteen shouldnt gamble according lawhowever casino ready pay money dannyher father coughts dont lets raise money eighteenoh come ongive breakwill yasince ive seen stupid childish scene instantly turned televisionsome things say series even child would boughtwho world could think full house entertaining funnyevery single word say series seems like shakespeare wrote itexcept shakespere knew write except wouldnt childish stupid write something stupid wrote script full house br br everyone bad heart kind bad medical condition life sense real worldi deeply recommend watch full housenot even one episode try outavoid seriessave self stupidity nonsensethis worst television show everid rather watch teletubbies thisdo watch,Negative,negative,-0.999355,0.31645917892456055
kennedymiller could hardly done better job tackling challenging exercise making dry political events work human drama providing evenhanded representation explosively controversial subject matterbr br key success first count brilliant acting although less impressed max phipps performance gough whitlam commenters clear standouts money john stanton malcolm fraser bill hunter rex connor latter must one easiest casting choices history hunter could perfect role second count series avoids myth objectivity trap narrator articulates sympathies director phillip noyce recently demonstrated leftwing credentials rabbit proof fence carefully evenhanded sympathetic dramatic portrayal parties adherence lady kerrlady macbeth theme popular among labor partisans perhaps little partial though ruinously particular credit due sympathy shown kerr extraordinarily difficult position placed whatever one might think actionsbr br however one sour note producers perhaps entirely blame portrayal jim cairnsjuni morosi affair come series background events get impression cairns morosi innocent victims smear campaign prurient gutter press producers may restrained respect australias stultifying defamation laws recently demonstrated willingness cairns morosi use suggested relationship sexual cairns would eventually admit year death however could made bizarre fashion morosi managed cairnss office treasurerbr br speaking defamation couple disorienting occasions dialogue obscured due injunctions taken offended principals beeping noise one occasion loud telephone ring another curiosity dvd release excises line comic relief scene customs officer played late paul chubb serves tirath khemlani arrival sydney airport next queue dishevelled looking hippie receives disapproving glare chubb presents paperwork original version chubb said something along lines drug bust bali eh obviously line longer rings true wake schapelle corby case dramatically illustrated busted drugs bali expect far worse deportation,Positive,negative,-0.998473,0.33912086486816406
movies massive amount non stop ninja action ninja iii domination story love redemption revenge however mainly story flipping killing people reason youve searching movie ninja goes absolutely nuts takes kinds people graves hes ninja movie cant think movies compare movie awesome wait oh ever seen thing two heads part titular thing riding around motorcycle million cop cars chasing itthem around keep crashing cant catch thing two heads well kind ninja iii like highly recommend film especially like following things ninjas swords lucinda dickie breakin breakin electric boogaloo video games bouncer bar ambiguous underdeveloped love stories good ninjas,Positive,negative,-0.584835,0.3072502613067627
ok years ago awesome funny movie mask came everyone loved years later mask brought back awesome movie right wrong movie stupidest movie probably ever seen mean rented thought would laughing hard would almost pee pants like first one saw sequal barley even let chuckle mean offense director cast movie waste time money plot whole story little baby part mask evil person thing really got would least added things would higher stars,Negative,negative,-0.9968,0.3032660484313965
fine poetic story beautiful scenery magnificent music score ive twice japan last year movie gave typical japanese feeling movement camera superb well actors goes deep feelings without becoming melodramatic japanese people sensitive kind well brought onto screen director playing superb light colors shows audience also possible let enjoy movie subtle fine details youve seen movie want see director real feel good movie recommend everybody,Positive,positive,0.970881,0.31124234199523926
oh boy oh boy cover worn vhs picture sandra bullock name written top think reason chance sell movie nineties sandra bullocks name bullocks fans dont disappoint sandra thing watch movie performance call acting rest movie fun watch first fifteen minutes bad going worse much worse directing awful acting awful script awful dialog awful action awful music quite good actually typical score eighties action movies movie bad goes close anything andy sidaris ever produced bad isnt proper word describe poor attempt movie still sandra bullock super cool sarcasm jake lamotta tried marlon brando br br think bring film dvd could cool write cover academy award winner sandra bullock hangmenbr br,Negative,negative,-0.999917,0.3125944137573242
