wow trashing disk timo roses rout city minutes south park meaningless cursing guess people dont get interested movie read quite positive stuff packaging look movie seemed far total trash expected rout citybr br surprise movie isnt total trash problem seems exactly timo rose tries walk footsteps german horrorsplatter cinema like olaf ittenbach likes means barricade parts extremely gory detailed gore fx really believable ok acting ok cases plain sucks hillbilly chick opening sequence ridiculous doesnt get better till shes shotbr br problem movie gory typical german underground vibe including classic booby shots blood ok fx modern feel like packaging already promised br br script total bs get typical hillbillylost woods story guysgal camping meeting degenerated hillbilly family everything leading towards torturemutilation scenes seems unbelievably random pointless first thing makes barricade halfheartedbr br random also perfect description lot camera work liked repetitive cut tweezers extended booby torture scene either material editor works hardware store even worse editing sure modern far better lot movies genre random got overuse typical exposure effect everywhere meaning time theres grainynoisy film look also thrown sake dont get meaningbr br like forementioned effects lot repetitive stuff example kills edited multiple repetitions stabbing punching ok annoying fake especially towards end annoying also attributes music permanently used without change background doesnt take long makes movie hardly bearablebr br comes biggest problem movie many others opinion make splatter movie trashy feel pretty idiotic polish special fx new school editing looks like take way serious fun decent gore fx plain wasted context classic gore fx ok computer fx scenes like stabbing mouth gunshots ending look rather sillyand splatter mostly sucks even movies budget decent artistsbr br often wondered time serious splatter movies barricade another example might time put tomb fun character trashy look script cheap try wrong turn tcm leading absolutely nowhere take literally ending random many things love splatter flick come barricade tries incorporate lot failsyou sure fastforward movie extensive disembowelment acid face meltingnipple pinching classic friday th style stabbing couple fingering tent bloody boobies hooray really hard get total failure especially see could something,negative,negative,0.996817946434021,0.7087502479553223
graduation day br br bought movie past week waited time could kick back relax watch good slasher gems got xtro watch never seen watched realized outdoor speakers also imagine neighbors thought felony came sing one minute hit im sure loud im sure think im weird chainsaw sound screaming moviesbr br pretty sub par slasher movie suspense story cool deaths almost seemed amateur side usually like movies like didnt click watch xtro st time margaritabr br dj eric austin tx,negative,negative,0.9934731125831604,0.1678154468536377
film sold onedollar walmart dvd feel like lost anything watching film except time enjoyed acting tom hanks robbie wheeling young looking gave outstanding performance considering horrible script story college students decided play game mazes monsters realistic setting robbie wheeling problems past playing game colleges advised parents leave game alone get good grades robbie meets nice gal romantic fling starts playing game stops making love acts like monk scenes film taken running around former world trade center also observation floor roof area rather sad viewing part film many human beings died evil world good film except tom hanks trying keep film sinking level entertainment,negative,negative,0.9929439425468445,0.25095272064208984
director eric stanzes isoyc ipoyg three men subjected torture hands woman sexually abused first victim forced eat crap axed death next bloke ends bullet crotch refusing anal sex first guys corpse third man gets worst watch heavily tattooed star emily haack get naked masturbate broom handle oh also gets handle shoved butt toobr br unfortunately get see masturbate isnot get broom handle buttsbr br yes isoyc ipoyg one harsh viewing experience relentless violence haack obviously misguided notion body goddess opposed roadie metallica constantly gets buck naked camera aint pretty sightbr br addition nonstop nudity inkedup haack viewers also get see dreadful direction stanze thinks endless shots tombstones trees entertaining stuff really bad acting fat guys penisbr br strangely enough give isoyc ipoyg rating actually slightly higher current average thats one point messy axe attack gorehound actually enjoyed one point bit fat guy gets face pushed chocolate mousse masquerading feces hilarious one point sheer nerve suggest film might somehow sequel meir zarchis superior exploitation classic spit grave,negative,negative,0.9961373209953308,0.5347254276275635
lovely tale guiltdriven obsessionbr br matiss lonely night stroll riga passes woman wrong side bridge railing passes without word splash water followed cry help causes act little latebr br film chronicles efforts finding woman troll local bars finds pocketbook pieces life together look changes obsession grows make things right marvelously filmed dialog bastard exboyfriend forces alexej face guilt feelbr br haunting long takes gritty soundtrack accentuate guilt barking dogs footsteps lovely film noir lovely twist good indie ending,positive,positive,0.9990695118904114,0.192732572555542
original trancers means great movie massive plot holes little way internal logic however entertaining better done lowbudget bmovies could surprisingly witty unfortunately trancers ii none thesebr br trancers ii suffers many problems flop sequels plot thin enough see writing insipid seems people behind movie felt bringing familiar faces first movie back would enough didnt bother anything else even veteran bgrade actors like tim thomerson jeffery combs able drag film muckbr br brief plot overview jack deth thomerson cop future sent save ancestors members government trancers ii takes place six years events first trancers jack deth married lena helen hunt woman met first movie live hap ashby man deth sent past protect discovered brother whistler bad guy first movie traveled back time create army trancers people turned mindless killing zombies kill ashby complicating jacks mission fact first wife died long jack traveled past also sent back stop whistlers brother jack finds working herbr br two real problems movie one method creating trancers movie radically different methods used first movie makes annoying rather poor example soviet revisionism act like always techniquebr br thing annoys love triangle deth lena alice stilwell jacks first wife given little screen time bothered particularly much interesting actual plot movie felt like something thrown fill space movie alices character particular seems unconcerned fact reunited husband find hes remarried making either shallow poorly writtenbr br reason think watching movie youre interested watching entire trancers series currently totaling six movies otherwise even youre fan original trancers stay away tepid sequel,negative,negative,0.997121274471283,0.5391480922698975
br br ok film wasnt going win awards pure bubblegum modern update wonderful life come cheap release dvd lot worse ways blowing get film surprisingly strong cast still year two becoming b list celebs however enjoyable way passing hour half dont think much,positive,negative,0.9065834879875183,0.09977912902832031
summary pretty much sums nowhere near good original script cowritten stallone james cameron time also writing aliens action written cameron political aspects written stallonebr br sly best condition physically making rocky look great shape jacked eyeballs steroids depending viewpoint opinionbr br rambo starts prison visited colonel trautman asks go special mission could earn presidential pardon eventually agrees goes briefing camp run charles napier playing washington suit trying pass former exforces placate rambobr br mission find missing pows still alive camps vietnam rambo chosen camp checking somewhere previously prisoner told rescue mission take recon photos onlybr br bad attempt parachuting plane loses kit meets contact turns cute woman travels river pirates campbr br finds still prisoners rescues one flee half vietnamese army river boat betrayed pirates rambo kills forced carry pickup point foot boat rammed blown rambo almost boardbr br rambo betrayed abandoned napier orders recall rescue helicopter clear trautman returns base berate survivors expected foundbr br steven berkoff turns russian spetznatz colonel rambo tortured eventually escapes pursued vietnamese troops spetznatz killing many rambo finally steals chopper rescues prisoners return basebr br resists urge kill napier abandoning destroys ops centrebr br weak plot weak ending rambo walks sunset free man,negative,negative,0.9985305070877075,0.4335601329803467
thieves liars presents us naturalistic depiction levels corruption affect many puerto ricans force make difficult impossible choices loved ones lives cast excellent considering nonprofessional actors excellent choice augments level reality film photography propels story without intrusion type film script captures idiosyncrasies attitudes boricuas deep way sometimes feels like youre watching documentary watching film feel youve secretly entered real puerto rican society stand invisibly watching implode loved,positive,positive,0.9948492646217346,0.16886663436889648
story would never win awards thats script entertaining suspenseful enough make room incredibly choreographed fight scenes needs story fighting like really worth watching reason alone handle gore lot none done realistically enough tough look gave,positive,negative,0.9215933680534363,0.08978962898254395
wasnt really interested seeing step friend kept bugging bugging see film especially since love channing tatum tease constantly saying thats reason loved movie somehow convinced movie worth seeing loved movies like dirty dancing take lead save last dance love step eh heck guess every movie way right viewbr br well know movies mentioned top dirty dancing take lead save last dance well put blender gangsta love thats mention youve seen movies well frankly seen step channing lower class street smarts naturally feels music snobby class girl must follow step step ever fall love different chance step passion mystery lust dance br br ok silly plot explanation like said long youve seen movies mentioned even saw plot get movie dont understand actually rating bet channing lovers lol im kidding guys good guess didnt get others passion mystery dance oh antonio bandares need br br,negative,negative,0.9636286497116089,0.29750514030456543
agree star reviews saw south southwest film festival austin films saw really good best one im sucker movies plot devices characters go transformations totally change lives excellent acting mostly done people involved tv first movie written directed jay floyd debut director jays day job apparently clearance administrator lots famous films forgiving franklins total delight extremely funny spots one movie would buy dvd rewatch truly high complement well done jay yesgive day job,positive,positive,0.9990703463554382,0.1756880283355713
premise movie simple script elderly muslim gets teenage son drive similarly elderly station wagon france haj mecca saudi arabia fulfill holy muslim obligation dies father clearly devoutly religious son unimpressed accepts obligation father rather religion hed rather nonmuslim girlfriend father stubborn lot things son doesnt understand petulance device maintains drama although often rather irksome however like good road movie oddball characters encountered along way example woman backroad croatia upon asked directions belgrade simply gets backseat points hand uttering one word assume place cant find map bulgaria another man ask directions confirms speak french provides extensive commentary bulgarian also occasional humor one country son tires eating egg sandwiches wants meat given goat unfortunately perhaps fortunately viewer runs away father perform muslim slaughterman ritual eventually make mecca muslim equivalent vatican much grander scale westerners bizarre fascinating movie isnt sophisticated charming way kind national geographic soul,positive,negative,0.9818670749664307,0.29594898223876953
thats considered verdict film also bulk written dont get wrong either im total philistine didnt hate movie wasnt enough like police academy whatever enjoy fair share high brow arty stuff swearbr br magnolia poor honestly mystified seemingly acclaimed long winded self indulgent rambling nonsense start finish little could credibly people love movie theres high calibre actors fair enough none turns average worse performance furthermore wife self confessed tom cruise hater tells career best performance far plot completely unengaging meandering stories several loosely connected characters snails pace even significant life changing events depicted seem pointless uninteresting find crying someone get blown somethingbr br doesnt help none characters easy identify empathise well didnt think dont like people admittedly play rather unentertaining life stories great length demonstrating character flaws emotions everso intricate detail playing deep meaningful relationships nth degree many waffling soliloquy en route yadda yadda yadda soundtracks dire well marrowsuckingly irritating quality hitherto thought unique music alanis morisettebr br enjoyable three hours forced repeatedly watch episode friends whilst intermittently poked ribs disgruntled nanny goat bit frogs good though,negative,negative,0.9955251812934875,0.42246460914611816
watching early demille work reinforced early demille far superior late demille attention use light within scenes remarkable pacing good enabling much told space hour pity wasnt intuitive style later sound films seemed silent filmsbr br first film seen cleo ridgely remarkable quite restrained yet conveyed broad spectrum emotionsbr br ending wonderful,positive,positive,0.9993045330047607,0.12717533111572266
may oscar golden globe film shows also perennial razzie nominee film bad must indication needs money could ads shouldnt talk cell phone driving especially night way crowded mallbr br susan montford stick producing shoot em good writerdirectorbr br accosted four thugs mall parking lot first thing tell gun starts pushing cursing like knows martial arts something manages get away gets lost forest crashing didnt run someones house get four thugs guns chasing lady toolbox course guns match wrench ha course also tire iron screwdriver poor thugsbr br shes home christmas brought gun,negative,negative,0.9940827488899231,0.3658280372619629
criticism film rather comment blind past br br recently watched winter soldier ground truth like watching remake sequel except iraq rather vietnam similar winter soldier onesided message films illustrate gleefully rush engage conflicts based false pretenses allow young brave often naive bear brunt greedy war profiteering films effectively show mentality forced minds young willing make efficient killing machines training falls woefully short teaching diplomatic policing skills necessary effectively win hearts minds people theyre supposedly fighting ultimately lost war vietnam likely lose war iraq well br br negative comment film onesided could easily passed left wing propaganda mind aiming discredit film message balanced point view would speak larger audience,positive,negative,0.9677372574806213,0.20183682441711426
well directed film john cromwell great director make fine films including version prsoner zenda set london hollywood could manage atmospheric nothing like real thing story obsession thwarted love novel somerset maughanbr br looking forward seeing dvd never seen great admirer bette davis wanted see role considered one early great ones bought well looked fine im sorry say london cockney accent made laugh bette davis one greatest film actors make mistake make one impossible take character seriously wasnt gruesome dick van dyke mary poppins cockney accent closebr br major role leslie howard superbly subtle intelligent actor supporting actors acquit well worth watching despite ms davis vocal gymnastics,positive,positive,0.9933797121047974,0.18443059921264648
well directed columbo episode also good character story doesnt really know interest enough doesnt appear well layered constructed often case columbo movie also goes killers plot kill uncle quite simple doesnt seem well thought perhaps movie didnt really took serious enough since atmosphere movie mostly light least compared different columbo moviesbr br instance movie features quite large amount comical relief mostly coming columbo character makes movie enjoyable one watch also gives feeling sort overdid times also mostly since doesnt correspond columbo moviesbr br characters good helps features martin landau double role always funny see much different still looked young man instance person peter falk hardly changed years got grayer movie also features julie newmar among others best know playing catwoman batman life action series funny still moves like catwoman movie intentional way actingbr br enjoyable good watch columbo movie also gives feeling could lot better better thought scriptbr br,positive,positive,0.8130634427070618,0.25550270080566406
enjoyed joyces complex novel keenly prepared disappointed joseph stricks fred hainess screenplay given fabulous complexity original text however film turned well done fine translation tone naturalism levity bookbr br certainly helps read original text viewing film imagine latter would seem disjointed odd episodes apparently randomly stitched together without prior reading text help grasp plotbr br amazing see filthy film given shot dublin irish film censors finally unbanned viewing general audiences ireland late shown restricted audiences private cinema club irish film theatre late joyces eroticism simply naturalistic raunchy offers many wildly perverse episodes never mind many fetishes unacceptable book published still utterly taboo film made br br astonishing heartening watch cream irish acting profession respected players daring utter enact joyces hugely transgressive text gustobr br bravo,positive,positive,0.9772055745124817,0.2739388942718506
okbefore even start less constructive criticism movie id like say words come heart movie sucks dont go see unless really like sweaty boybands woodenacting noplot stories lets go think movie bad story line plot director tried create mystery feeling wasnt whole thing looks like big hour half promotion kind gothwannabebutstilllookinglikebsbband guys school perfect abs fat ugly young people good looking girl movie well one main character either wet swimming pool sweaty bed poor guy must awful go date sweating like guys something good powers anything good like put fire old barn help friend got accident instead running around breaking things showing front wooden acting main character two expressions face expression number one sad expression number two trying look seductive still seems sad boy band guys main characted best friend got accident blondy fourth one name fourth one think spoke twice throughout whole film beginning said jumping cliff using power wont kill second time end blondy lost girl movie could done without one would notice anyways verdict perfect score film guys go see little action suspense hot girls girls least actors good looking would advise people get soundtreck movie thats thing liked,negative,negative,0.9953956007957458,0.35669374465942383
movie everything emotion power affection stephane rideaus adorable naked beach dance exposes need real inner communion outer communication relationship cedric mathieu couple happen gay doesnt mean isnt quite useful insight anybody would probably classify gay movie one appreciated loved heterosexual people well homosexual bisexual people mathieus incapacity handle emotions divulges way society doesnt encourage us act differently engenders discord cedric definitely mustsee,positive,negative,0.9754694700241089,0.21599936485290527
happened see promo movie spike channel last night grouped patrick swazy rerun another movie made thought swazy sequelboy wrongi see screen writer also starred im thinking budget bit tight surprised see patton film far better credits name playing c movie like bussey jr trying hard portray image fatherone best bad guy actors ever failed miserably redeeming qualities movie chicksgood looking lots ta worth time hard earned dollar rent,negative,negative,0.9876684546470642,0.15594172477722168
entirely impressed film originally named sin eater stayed way considering talked last half film im even sure first minutes film rest slow picking robocop peter weller one main actors sad pointbr br would say check things dealing catholic religion dont expect exorcist stigmata film surely flop days word gets,negative,negative,0.6872534155845642,0.10449337959289551
years weve seen lot preposterous things done writers show go matter keeping simple rules going john ritter died comes mind probably first time cared idea show without eric lesser extent kelso ridiculous tried cover comeback leo increasingly outrageous story lines always felt like bother dont main character anymore didnt really connect bunch unrelated stuff happening time wasnt even funny last season felt like season much every single character simply eric used take lot screen time wed smashed face stale repetitive rest characters focusing gimmick fez thoroughly uninteresting character would simply stop working whole deal hed say something weird nowhere cant say stuff nowhere every second line also brought standard cousin oliver time wasnt kid whenever heard somebody knock door started praying wasnt randy please let randy deal randy hed really awful jokes usually red would say smiling like ass totally screwing delivery donna would stitches think half last season donna pretending amused problems started earlier though truly great show equally great concept wasnt dysfunctional family slowly got territory soap opera everybody started love everybody emotional scenes dragged nausea one usually lame joke placed somewhere divert attention watching world turns im guessing character development come written almost clumsily moral lessons family matters fair last episode also cameo topher grace cameo show really good even funny eitherbr br way yet criticism season hell opening theme use joke twice character singing fez scared hell dude dont open eyes far first five seasons soamong best comedy ever broadcast,positive,negative,0.9977739453315735,0.44856762886047363
went see glenn mcquaids sell dead north american premiere toronto dark film festival seeing second showing worldwide didnt quite know expect film especially seen short film inspired big screen adaptationbr br ill start slightly elaborate plot synopsis without giving away spoilersbr br movie arthur blake became grave robber interesting supernatural discoveries mentor discoveredbr br costume set design film excellent amazed hear entire film shot around new york costumes accurate time really bringing viewer mindset time movie works well periodpiece horrorcomedybr br interaction two leads fluid played others acting ease dialogue two well written glenn adding comedic touch even tense situationsbr br story encompassing ball gets rolling start id compare visual page turner always wondering happen next characters vivid unique adding different emotional layers film itselfbr br recommend film anyone mood dark humour bit horror mixed inbr br,positive,positive,0.9980280995368958,0.23256611824035645
dont know sue kramer director film strong suspicion lesbian b somehow shamed everyone involved project participate prove homophobicbr br imagine everyone thinking god horrible funny pedestrian totally lame keeping mouths shut fear labeled antigay dont get gay lifestyle probably kramer cast gay people play gay people anyway even worth reviewing actors directed play every scene completely top sincerity believability anything full clichs nothing movie least bit amusing much less funnybr br hated im afraid say bad gutless people gave kramer money make bomb werent unbiased judgment,negative,negative,0.9976561069488525,0.209977388381958
slow slow slow mystery excitement film dont figure mole first ten minutes must brain dead secret service must took whole film put together compelling characters movie film pace movie slow tension hired killer excellent shot unless aiming michael douglas seems able hit large panes glass funniest scene movie presidents wife says code word anticlimactic ending laugh loud ridiculous least six people got left movie early would joined sitting middle row would recommend film anyone,negative,negative,0.9652939438819885,0.24431467056274414
really liked film much story okay bit slowmoving spots moreso incredibly beautiful scenery greece greek isles susan sarandon utterly engaging carefree love interest john cassavetes man edge scenery oh oh oh,positive,positive,0.9996414184570312,0.1132349967956543
first saw movie theater years old still cracks muppets cool approach show business refreshingly naive way favorite scene rats start whispering campaign behalf kermit fancy restaurant one smart funny movie kids parents alike long live kermit miss piggy rest gang,positive,positive,0.6298362612724304,0.10635852813720703
entertaining jim belushi vehicle modern cockeyed version wonderful life michael caine plays sortof angel lets belush see life would like made big jim best good story supporting cast seems like real chemistry hamilton oscar contender good warmhearted fun,positive,positive,0.9997389912605286,0.32050609588623047
