favorite jackie chan movie interview jackie said favorite well contains unbelievable stunts jaw dropping fight sequences well funny scenes well movie favorite brandon lee used parts rapid fire also lifted tango cash used opening scenesbr br jackie plays policeman hong kong story immediately jumps fantastic chase shanty town continues jackie slides hill jumps onto moving bus catch evil ku one greatest villains jackie chan movie expect funny scenes jackie tries balance duty policeman girl friend played maggie chung job protect kus secretary enough information take even poses many problems jackie absolute best last fight scene mall favorite fight scene anyone period intense fight ever seen jackie climaxes slide pole amidst exploding lights one greatest stunts ever left skin pealed hands fortunate electrocuted person charge stunt used high voltage instead lower voltagebr br another chan classic definitely one greatest movies end movie tell held absolutely nothing back neither stuntmen many stuntmen injured movie nobody would insure anymore jackie take responsibility gimmicks wires standins truelife action treat watch type action made phenomenon movie amaze people years seen movie fan jackie chan action general give treat watch movie truly sensational,positive,positive,0.9969221949577332,0.33721470832824707
favorite movie ever watched least times cry every time family begs watch wont crying fit think love true story written antwone much love movie acting top notch actors perfect role denzel washington one favorite actors favorite movie done far took care little boy also born jail precious little boy ever met adopted wonderful family fought almost two years saw movie fight still going future unsure happy safe loved happy antwones happy found familybr br would love know since meeting family cant say enough good things,positive,positive,0.9979031085968018,0.2121598720550537
enjoyable project film title suggests good performance nadia dajani reenacts role grace follows reenactment happens mike grace new york city leaves wants get contact project way trying getting touch herbr br saw ifc heard released dvd well like trend independent projects example good projectbr br hope finds herbr br take look entertainedbr br kirbyef,positive,positive,0.9986764788627625,0.33531928062438965
im really suprised movie didnt get higher rating imdb one movies could easily get someone romantic comedy moonstruck really class setting ethnic charm things people seem take granted casting alone makes nearly perfect movie movies good moonstruckand funny,positive,positive,0.9985437393188477,0.10119891166687012
seagal fans beware action scenes almost hour mess instead seagal runs away numerous fights letting ja rule convincingly lose every battle actually ja rule could coming action star hollywood needs let least hit puberty happen years also sort commandoterrorist wears baremidriff outfit chick atrocity looks like backup singer christina aguileraback seagal finally cut loose stunt double heavily padded resemble bloated seagal lot work taking falls dont remember aikido either standard kicks punches youd see straighttovideo martial arts turkey even sobaditsfunny either plain dull,negative,negative,0.9990338087081909,0.2703871726989746
probably cultural thingsomehow natives country conditioned find stuff funny experienced phenomenon firsthand openair cinema event film shown feature indigenous audience laughed wasnt sanitarium clinic retarded children welltodo area audience consisted mostly educated adultsbr br must possible somehow find amusing honest goodness idea takesmaybe air water prolonged exposure causes condition something must cause obviously thing say quite sure doesnt cause movie itselfbr br jokes brain dead stupid nonsensical unfunny lame short waste time tom jerry funnier heck even funerals funnierbr br case fortunate enough ever seen stooges performances three guys behaving running even talking like retarded infants causing kinds unfunny mayhem plot real purpose real conclusion like ugly teletubbies without cute costumesbr br sitting crowd watching garbage country quite exasperating feel like party bunch potheads one hasnt smoked anythingbr br unless prepared intoxicate make bearable come equipped whatever makes people think watching three ugly old men behave like morons funny advice stay way far away,negative,negative,0.9950833320617676,0.7452647686004639
aint bad aint good entertainingbr br comedy supposed dreadful many laughs every joke movie done million times beforebr br shame actors film great usually none really much ending sucks,negative,negative,0.9983447790145874,0.14655184745788574
parading around yearold girl thong swimsuit one fans movie id like ask would allow daughter walk around resort dressed like would yearold able handle reaction shed get men yes id like know counts suit like clear invitation men hypocritical suggest thats br br another point teenage girl would ever claim father lover without excuse severe mental problems thats almost disgusting swimsuit br br simply put things funny appropriate never,negative,negative,0.9926642179489136,0.24747848510742188
suspect board soon full comments overemotional people praising dear john pearl rollercoaster ride vacuous words films target audience typically employsbr br definitely films target audience dislike romantic dramas either long well made objective take flickbr br goodbr br bad movie either plot meanders development stagnates shouldve moving forward right around middle precise endingit almost felt run ideas suddenly said hey lets film last scene real quick put sentimental string soundtrack end way even amanda seyfrieds beauty could save channing tatum gave good performance much flawed scriptbr br speaking music unbearably predictably kitchy smokey voiced irritatingly highpitched female folk singer schtick surely chosen appeal majority collegeage girls go see movie overused shimmering strings piano combo annoys anyone paying attention film whole rather feelings film good beginning major conflict launches us second act promising part second act story unfolded film dropped ball beyond id give spoilersbr br dear john bad movie doesnt work either want see truly moving film prolonged love waiting reunited go watch notebook truly superb,negative,negative,0.9786475896835327,0.40745973587036133
absolutely thoughtful spiritually deep intense hamlet ever done version comes close jacobi best understanding role actors played patrick stewarts claudius ferocious still sympathetic particularly like two doofuses playing rosencranz guildenstern feckless yet sinister might gripe need strong ophelia shes strong person thats point lalla ward hits proper nuances amazing simply amazing every one two dozen times ive watched,positive,positive,0.9995177984237671,0.17200493812561035
surprising film made im time im examined early beauty tragedy chosun dynasty life seopyonje delightfully explored wellknown korean folk tale chunhyang comprised last two films surprising chi hwa seon offering presented pansori style previous two filmsbr br nonetheless experienced hand im comes explore together life real person late nineteenth century chosun dynasty painter rides edge modernity noble causes stir contemporary korean society fame public artistic expressions disdain old korean noble class contempt wouldbe japanese ruling colonials alike painter chang seung known popularly oh performed magnificently choi min sik famous star park chan wooks already legendary oldboy becomes influential therefore dangerous throughout film contemporary korean audiences back hero like despite fact maybe fact ostracized time ims sense simultaneous beauty tragedy history remains intact im master capturing countrys past idiosyncrasies film almost outdoes expected im film cinematography breathtaking editing precise story centralbr br plots set seung family ties tested broken scandalous behavior alleged sometimes real bring man painted fire intricacies ims detailed sometimes convoluted account seung ups life seung somehow manages survive becomes legendary ability perfectly copy famous chinese paintings one look art dealers agents besiege try make money oh words lines people wish take advantage real seung artistic star begin form refuses manipulated cleverness staving massive hordes imperial lackeys impresses audience cast br br seung think possesses powerful emotions opinions painting aesthetic belief paintings living things never truly finished despises would try turn art profit cares politicians use might bring artistic beauty around cast artist traitorous also thinks painting plays role coming upheavals horrid scenes involving foreign invaders france japan presented ims signature historical epic motif influence realm remains prominent display multimillion dollar epic br br protagonist causes greater grief care refuses paint story takes whole new meaning one political social nature im takes issues laudable realist fashion br br oh becomes jesus figure people believe capable artistic miracles government feels needs artistic support protagonist remains fiercely independent contemptuous others want eventually government people come upon seung manner taken straight bible holiness becomes human humanity accepted dies escapes sins commoners art critics politicians hound br br die ims films question remains case seung really become immortal hermit film tackle question merely presents possible end real man chang seung oh death depicted death known br br difficult find fault film im become good presenting various historical absurdities culture hardly surprises anymore usual ims films cinematography editing writing first rate wellcrafted film imbued ims uncanny storytelling ability granted may best ancient korean musical art pansori still film contains stretches admirable art form end viewers feel become privy great untold story precisely ims gift,positive,,,
scifi fan always curious film excited see journey far side sun finally get released affordable dvd previous print fetching ebay im sure people wish money back secondbr br anyway premise film like twilight zones parallel undiscovered planet resembling earth side sun planet course exactly like except inverted basically means letters reversed people drive wrong side roadbr br sound intriguing well thats basically film first hour dedicated preparations journey planet tedious scenes switches pressed banal dialog etc theres point whatsoever gerry anderson managed find boring british actors history cinema play roles mean dull im surprised crew able stay awake finish filmbr br anyway crew finally lands planet interminable sequence astronauts sitting literally sleeping cockpit roy thinnes notices copy backwards bottle cologne hops back another ship tell people discovered oops never gets crash lands dies end oh wait theres bonus scene one space executives hurling mirror wheelchair end guess wanted film toobr br im really surprised film like could get made even back rent must buy,negative,negative,0.9712796211242676,0.4469876289367676
latest film spanish director agusti villaronga study children experience violence isolation within remote community develop troubled young adults need certain psychic tools deal hidden mental frailty whether tools religion followed fanatical level caring others simply putting macho image whilst engaging maleprostitute villaronga creates successful examination vices affect three teenagers living spain franco three witness disturbing double death friends teenagers subsequently bury emotions feel peers frail corpses meet hospital suffering form tuberculosisbr br cinematic style text typically visually opulent would expect spanish auteur extremely reminiscent fellow spaniard pedro almodovars work themes dealing sexual desire heterosexual homosexual element different two directors villaronga favours supernatural undertone spliced claustrophobic gritty realism opposed almodovars use surrealism although styles similarbr br piece gives insight troubled young psyche contains disturbing violence scenes sexual nature highly recommend watching film contains elements remain audience considerable period viewing,positive,positive,0.9914816617965698,0.6142818927764893
become extremely difficult find good horror movie anymore thought movie good thrillerbr br could better production values kept going suspense twists real reservations seeing movie cover afraid would excessively bloody gory wrongbr br although lot scary parts lot suspense drama toobr br acting dead line better would expect micro budget horror flick characters believablebr br movie really thrilling quite scary moments makes grab seat ending credits rollbr br production values sound good example,positive,positive,0.9872077107429504,0.22043871879577637
although film less forty minutes one best directed acted stories ever seen accomplishes less minutes films br br story two brothers one come poor farm family mississippi caught war conflict duty verses love familybr br brought tears eyes especially entire film well acted directed plus tells story many wars one serves left behindbr br fully recommend film beyond superb,positive,positive,0.9996277093887329,0.18757247924804688
despite small handful nicely executed scenes entry fourth feels tired toshiharu ikeda directed superb mermaid legend seminal japanese splatter film evil dead trap shows little enthusiasm stale premisebr br miscreant becomes obsessed outwardly conservative woman reluctantly appeared porno photo shoot predictable stalking harassing assault rape ensuesbr br staple roman porno sex sex mixed violence potentially exciting subjects sure little effort made make fresh masturbation scene woman forces pencils opening via condom little kink latebr br series rain motif continues films final scene brings relief,negative,positive,0.6214748620986938,0.7930033206939697
ever watched movie lost plot well didnt even really one begin withbr br begin achingly tedious scenes heroine sitting around house actually sense menace even foreboding created even apparently constant thunderstorms strangely never actually heard housegreat double glazing house apparently miles town yet several hours walk away third girl serves purpose plot except provide surprisingly quick gory murder tedium becomes unbearable even beginning suggests spate killings throughout area even though apparent killer never ventures far house bizarre ritual salt pepper pretty much sums films inherent lack directionbr br add lead actress cant act least willing completely irrelevant nude shower scenes video truly nasty way hopebr br given following simply banned uk mostly final surprisingly extended murder offers nothing curiosity value one classic daft murder dont worryits telegraphed least ten minutes beforebr br walk woods victim comes rather steep upward slope obviously struggle halfway see figure top dressed black brandishing large scythe slide run like rest us course struggle top stand conveniently nice upright front murder weaponbr br really movie say,negative,negative,0.9977824091911316,0.57767653465271
waqt perfect example chicken soup exactly soul broth unfortunately lost actual taste thanks excess dilution garnishing went makingbr br whats surprising disappointing waqt comes director stayed away usual clichs hindi cinema first venture second outing gives stereotype film formulas vipul shah conviction show something implausible blind men robbing bank aankhen fails induce life entire packaging waqt based something conceivable fatherson relationship adopted gujarati play aavjo vhala fari malishu waqt sensible storyline social message back mature look fatherson relationship fathers unconditional love towards son sons responsibility towards family ishwar chand sharawat amitabh bachchan established entire empire scratch leads affluent life wife sumitra shefali shah son aditya akshay kumar never need strive anything since got everything tailormade spoonfed life ishwars pampering spoil morebr br aditya dreams turning superstar nothing make dreams come true meanwhile marries ladylove mitali priyanka chopra ishwar hopes marriage make aditya responsible man disappointed aditya still blithe best leading carefree lifebr br endurance limit finally collapses ishwar expels aditya house sudden change attitude affectionate father towards expecting wife baffles aditya option left strive livelihood wife unborn kid starts turning independent man rift relationship father growsbr br story simplistic uncomplicated screenplay elementary approach one easily identify relate credible characters father son one two least might come across individuals like somewhere real lifebr br add director vipul shahs easy handling screenplay family affair like director place would added tons melodrama proceedings per cinematic laws bollywood family dramas turning film compulsive tearjerker however shah excels effortless handling emotions part filmbr br clearcut example unpretentious direction palpable preinterval scene father expels son house rather frivolous manner purpose scene achieved without blotting brunt audiences brains ditto scene second half wherein separated father son flippant conversation thats differentiates waqt kabhi kushi ghum ek rishtaa fact places one level high terms treatmentbr br gaining distinction points one may wonder waqt still fail problem lies fact waqt distinguishes others league terms treatment gives glitches terms packaging director forcing songndance every first half theres johar kinda shaadi song chopra kinda holi song father son disco dandia song dream song dream come true song inducing sufficient yawns viewer picture father ousted son house son dreaming song moroccan mountains wife place reason audience seatbr br film drags first half actual story starts second half director wasted much waqt unnecessary elements much talked dog chase sequence isnt bad redeeming either however akshay kumars taandav dance simply ridiculous imagine qualifies star hunt movie unintentionally hilarious histrionic add climax set finals starhunt son bursts emotions thats archetypal also editing pattern could reversed conceal fathers reason change attitude towards sonbr br anu maliks music fine though unnecessary proceedings santosh thundiiayils camerawork competent enough though much demanding aatish kapadia come good dialogs dramatic momentsbr br boman irani rajpal yadav make light moments film efficiently rajpal yadav going overboard comic histrionics many films lately time underplays character completely restrained deadpan expressions perfectly complimented bomans overthetop histrionicsbr br shefali shah convincing mothers role taken censure flawless playing looking character priyanka gorgeous performs part wellbr br course major applause deserves akshay kumar amitabh bachchan akshay especially expressive scene doting father intentionally berates make aware responsibilities though bachchan goes bit dramatic couple scenes brilliance strikes throughout filmbr br sum waqt like soup whose ingredients tasty nutritional final recipe somehow isnt much appetizing,positive,,,
bad movie br br plot weak acting bad science worsebr br special effects unconvincing dramatic scenes joke every step way see coming mile away end disappointing suspense best aspect film soundtrackbr br reason give lower vote tv movie believe budget low start withbr br believe young female fans luke parry still see movie however done better work terrible terrible choice look something else,negative,negative,0.9995847344398499,0.2635791301727295
absolutely love first three movies great caught part vhs years ago disappointed perhaps never saw fourth one shot backtoback finally viewing copy today say way better number expectations werent high begin cheap directtovideo stuff even horror movie pg acting convincing story rather dumb without excitement many effects main problem kills gore annoying kid gets killed car supposed highlight come onbr br surprisingly parts directed sequeldirector jeff burr gave us excellent stepfather ii leatherface texas chainsaw massacre iii liked puppet master legacy even nothing else tribute best scenes moviesbr br overall puppet master much like hellraiser series great trilogy forget rest,negative,negative,0.9926156997680664,0.4770190715789795
years ago saw remake sixties classic mini coopers first time remember liking lot two years later shown television wanted know whether would still like much saw cinema well answer yesbr br movie team robbers one final job venice italy plan flawless execution perfect escape wont work rest lives one problem didnt take account someone within ranks doesnt like split loot wants keep even means kill rest crew one survive revenge one year later los angeles time surviving team members create smart devious plan steal back gold get revenge traitorbr br story course original since remake original movie plenty goodies offer make forget typical heist action movie certainly one better ones kind action nice landscapes venice real eyecandy story ok special effects stunning even acting good something youll often see action movie must admit really liked saw give movie well deserved,positive,positive,0.9895867109298706,0.5556044578552246
could great voiceovers exactly right fit characters one small problem though look characters mostly supporting guest characters look exactly bored look every face minor changes hairlines weight size looks kind odd see really big guest stars voice coming lifeless form like characters mistaken kathy griffin voiceover show looked odd funnybr br problems one family plot simpsons much better could actually buy situations characters got get much annoying diversions like someone weird fantasy supposed find funny reason delivery bit probably tell hard put finger exactly wrong show basically nothing clone simpsons even married childrenbr br point finger totally wrong probably repetitiveness peter griffin really bright character neither others lois named lois lame sort onedimensional seth green kind retarded son best thing show stereotypical part showbr br say isnt exactly anything wrong show long run admit takes lot work simpsons done almost two decades,negative,negative,0.9995942711830139,0.3174400329589844
watched years ago television sick dont know tend complacent tv viewing im sick much effort use remote control guessbr br recall every aspect moviecasting acting writing directing etcwas illadvised best could forgiven historical inaccuracies film created sense like work trinity didnt attempts humanize scientists insufficient never transcended caricaturebr br didnt know much people involved manhattan project time portrayals movie cartoonish became interested learning real personalities guess horrible film done small amount good allbr br indepth review fmlb neither deserves requires one might enjoy youre fan bad movies,negative,negative,0.9988042116165161,0.2867755889892578
loomis gives quick recap micheal myers flashback jamie kidnapped man black burning police station explodes micheal returns haddonfeild find jamie baby version loomis character gets scenes seems much proactive final cut score much better line parts none electric guitar bs ending makes tad sense reasons coupled fact cut characterization suspense cuts back gore factor halloween unlike say friday th franschise never blatant gore prefer bootleg producers cut say cut magically turns turd gold polishes turd little bit makes comprehensible whole cult plot still stupid micheal fathering kid br br producers cut grade c br br theatrical cut grade,negative,negative,0.9962363839149475,0.4187171459197998
film hilarious original beautifully directed become big bad swim groupie tracking film festivals whenever wherever ive seen half dozen times time enthusiastic audience response confirmed feeling one best films come years nearly every festival screened either sold audience favorite award clear people love film even clearer cinematography superb characterization acting brilliant ending fantastic direction filled compassion wisdom art perfect timing hard believe ishai settons first film hope released soon everyone see,positive,positive,0.9994750618934631,0.26575398445129395
dont give much credence aids conspiracy theories sociologically interesting see phenomenon dramatized early years aids epidemic suffering paranoia scared dying often generated dark fantasies especially true politically radical sexually extreme demimonde san francisco city renowned beauty rarely appeared uglier film sense darkness decomposition pervades every scenebr br acting plot cant said welldone films unique cultural context oppressively dark mood least partly saves film complete loss actually found interesting performance irit levi crusty cynical jewish lesbian police detective shes interesting though necessarily convincingbr br highlights films use garishly tragic turandot effective motif sublime silent cameo iconic performance artist ron athey,negative,positive,0.7807628512382507,0.5330581665039062
really sad shows like six degrees brothers sisters true reality tv garbage nothing glorified game shows think ground swell discontent past years premature cancellations numerous shows cult following vocal backlash fans jericho also enjoy shows networks may start reverse trend like others support new shows given second season ill possibly make decision watch catch via dvds online viewing abc lost viewer new show,positive,negative,0.9949855804443359,0.13286447525024414
