six price one bonanza time cinegoers isnt one two sixlove stories ensemble cast top stars bollywood plus stories genre favorite top directors johar bhansali chopra et al get see every damn type love story enjoyed rather tolerated years big deal need anything sir thank sir enough enough please spare us signed every top star manage sign whether required end making circus stars believe crowded every thing depicted exactly prescribed bollywood textbook romances plus justify length given story stars therefore longthree hours plus gags filmy characters filmy problems barriers situations resolution yes guessed right filmytried tested hundreds dancers dancing colorful costumes background work couples sugarysweet fairy tale type picture perfect good looking story beginning perfect way therefore ends also impossible perfect manner haphazard cant connect single story everything already seen million times bloody fake unreal escapist abnormal stories considered normal hundred years since evolution indian cinema mockery sensibilities todays audience yes could worked parody paid tribute lovestories yesteryear alas even thing explored least director nikhil advani attempted one unconventional offbeat love story happen tradition living mark commercial bollwood potboiler brigade oh somebody carry imagine one hand audience finds difficult sit one love story six times pain mean six damn stories mean double fun chopras mohabbatein year age time get something real guys desperate see colorful people bright stories oh said come entertainment advice please dont waste time henceforth reading reviews go instead entertainment thank,Negative,positive,0.588066,0.30673789978027344
havent seen films antonioni people saw one agreed shares themes imagery rest works maybe seen stuff would enjoyed one knowing expect br br saw almost complete failure many reasons first film introduces interesting deep issues social relationships feelings nature reality versus fiction often done clumsiest ways making characters speak delivering speeches rambling juxtaposing declarations rather dialogues scriptwriters seem worried get point prefer tell instead showingbr br secondly movie rhythm especially first half slow slow films made excellent sense pace rhythm el sur victor erice scorseses age innocence examples like successful necessary find characters engaging story moving adapt happen beyond clouds first episode seems drag endlessly relationship john malkovichs reality love stories fiction times fluid others abrupt others confusing,Negative,positive,0.976647,0.29305076599121094
im sure circumstances director visconti decided film james cains novel postman always rings twice im even sure viscounti acquired books rights resulting movie definitely interesting best version cains story like version best thanks viscontis excellent direction casting clara calamai massimo girotti sensual couple must noir fans visconti mixes neorealism noir sensibilities great effect film perfect though main complaint film little long good story moves slow pace dont think visconti good editing films think film noir works better short running time fortunately calamai girotti magnetic actors keep viewer interested anyhow much like film remakes think one made definitive version cains muchpraised book,Positive,positive,0.989905,0.32587742805480957
swear zombie killed like twice kept coming back gave movie lets face folks exactly reviewers saying ie handycam shot film hey hey hey welcome total indy film making fact todd sheets got zombies appear movie tribute talents yes story gaps yes see zombies really cares take fun gory horror film one share buds gross people really care lol mellow people suppose liked hunks garbage like titanic twister instead peace support independent film making,Positive,negative,-0.894263,0.3493974208831787
jon goods wife simply one worst titles film ever red right hand another absolutely awful sounding title means nothing relevance film saw set salem massachusettes incidently year born quite possibly best thing happen days five old college friends meet school reunion gayboy fagot roger mather john kuntz surname real say loud martha alden kim brockington rebecca lawson jenna stern boyfriend jake stabler john doe alan hobbes michael kevin walker wife sandy megan rawa plus john good marc ardito spelling john different title wife sara abigail morgan word go uneasy tension air someone mentions missing friend calef jason winther lots unpleasant memories come flooding back comes phone calls mysterious nosebleeds hallucinations guilt true horror events years ago finally comes lightbr br produced executive produced directed kurt gioscia also wrote thing kurt st thomas gets art direction credit wasnt enough act film well personally thought jon goods wife awful mean cant cook anything ha ha ha joking seriously though didnt think much film overall start pretty slow going entire first minutes solid snooze material reunion consisting lots catching dull character building exposition film never explains whats weird nosebleeds gods sake mysterious phone calls almost inconsequential death one group might might natural hell sara comes across nosey sex crazed dirty talking shameless bitter blackmailing knowitall whore apparently sleeps every man meets dialogue spouts wouldnt place porno seems totally odds rest film plays like drama horrorthriller supposedly meant theres ending theres worse way end film leave literally everything hanging air closure whatsoever yet see whole thing predictable well mean anyone watching going know mention friend calef went missing wouldnt itbr br directors gioscia thomas make infuriating film top predictability annoying climax retrospective narration alan simply dont understand less significance anyone else point time narrating reasons behind narration never made clear elaborated upon theres tension whole things bythenumbersbr br technically film ok nothing special locations clothes didnt look particularly authentic never convinced taking place late acting alright actor john kuntz last name suppose wife standing next could describe couple kuntz rightbr br really didnt think much jon goods wife blow doll would better ha ha ha im sure would appeal forget gore horror violence scares atmosphere excitement fact forget everything would made film watchable aint recommended,Negative,negative,-0.504051,0.34790492057800293
never comment film say one worst films ever seen feel made beginner film student put talented film students horrible buy lead actress felt acting class film decisions safe feel mimicking actresses films acting making decisions direction confusing sound louder actors end may made little sense someone narrating events song love patsy cline songs appear quite frequently films maybe song selection could little original song crazy clich said never comment films seen share good bad worst sorry,Negative,negative,-0.913098,0.3079519271850586
personally think sayonara greatest movie ever made touched every emotion anger romance complete tragedy brando best actor anyway movie awesome man attractive men women reason see fall love,Positive,positive,0.953665,0.3742964267730713
agree aussies comments part however id seem fairly decent plot unoriginal christina kelli mccarty inherits rural property intends open mountain lodge gets reacquainted chip bobby johnston known growing plot thickens james paul logan arrives new stripper friend shene devinn lane christina james stripper friend years gone implication james done wrong somehow add interest movie sophia linn monique parent romance novelist shows guest lodge eric sebastien guy linda flower pair lawyers city james sicks local building codes inspector christinas business one dirty tricks shut question far james go sabotage lodge succeedbr br watch devinn lane beauty betrayed seems making transition hard core business r world another notable samantha mcconnell playing role bait clearly outrageous character name movies,Positive,negative,-0.775041,0.34297823905944824
caught film test screening surprised find really sweet fun story well acted natasha henstridge next julia roberts male lead awsome funny film takes place best locations new york made want go saw youve got mail thought much better story fresherbr br clean great whole family think well audience saw loved definite recommend,Positive,positive,0.999876,0.3538644313812256
lackawanna blues drama details life strong woman name rachel crosby epatha merkerson rachel referred nanny know could easily called wonder woman epitomized strength power confidence resolve owned home used house every type person society would reject tenants consisted lesbian psychotic war veteran amputee host vagrants made home miles away ordinary successive event rachel took stride handled flawlessly wasnt dictator devoid compassion fact quite opposite displayed compassion almost fault giving shelter refuge many seemed overextend herselfbr br merkerson good job believe role right alley anyway movie even keel never straying rachel course dramatic moments expected nothing ever shocking profound rachel,Positive,negative,-0.955593,0.30536961555480957
film totally mindblowing manages thought provoking funny tragic cinematic yet claustrophobicbr br although flashbacks unnecessary film maintains pacy punchy grip performances excellent particular alec baldwin mesmerising eric bogosian films antihero barry champlain,Positive,positive,0.996566,0.31320929527282715
remnants ambushed army unit hook group cowboys fight way indians warpath sounds like could exciting western one dull dull dull moves like molasses action scenes uninspired acting pedestrian writing flat even photography isnt good eastwood early role plays exconfederate doesnt like idea fighting side yankees thats remotely interesting situation whole movie eastwood wasnt experienced enough actor pull character comes across petulant rather angry embittered ordinary western actually lessthanordinary western worth look youre diehard eastwood fan want see beginning career otherwise dont bother,Negative,negative,-0.990282,0.32531237602233887
excellent moving story end uniquely intimate affair point film paraphrase another comment every relationship unique intimate truly quality short film caught busiest yet power pull onto sofa watch fixed quiet duration bobby tessa powerfully moving characters anyone suffered end love affair find film cathartic exercise beyond film within film idea plays well cast quite riveting though somewhat melancholic way,Positive,positive,0.970444,0.33908939361572266
film oscar petersson unique uniqueness doesnt lie story since many half brained hollywood production served us comparably miserable plots rather thorough way complete utter lousiness one aspect joined equal lousiness aspectsbr br dialog worse embarrassing rotten acting abysmal direction thrown mix bosnians speaking english heavy swedish accents add unintentional element humor uninspired lightning camerawork icing turkey film cake sort surprise audience completely unmotivated slow motion sequences youd least expect add insult injury whole thing cut someone devoid sense timingbr br bad guy henchman turns good hearing good guys speech scene church point time dethrone ed wood position worst director times move ed wood comes oscar petersson,Negative,negative,-0.999911,0.3355989456176758
good deal running around badly conceived adversary little complexity scientist works communications sending signals space receiving gets caught aliens along pretty wife invades territory given secrets becomes rather traitorous process granted given little choice anyway scene gives everything want dull movie lots long stretches little happens plot isnt technically bad usually following car trip woods investigating building editing suppose story wouldnt technically support much much,Negative,negative,-0.980221,0.37050628662109375
one line summary explain ill go itbr br getgo movie seemed like overdone soap opera thats comment interesting scenes big one hit middle movie wait whats earthquake gasp wait minute thats dantes peak well parts butchered slapped cant believe poorly movie done borrowing scenes much better films one wonders director thought viewers dumb enough believe large wooded mountainesque backdrops exist downtown la ala dantes peakbr br advise forget bond wannabe nash film go real thing someone dantes peak coincidentallybr br,Negative,negative,-0.999577,0.3690214157104492
writerdirector film obviously doesnt know anything film think dp project tied replaced monkey every seen either dark hotter hot spots sun br br story awful characters one dimensional someone said film made poker fans film fans someone kidding self probably writerdirector poker fan world likes movie even money man hates project go casino play hands doesnt give experience write poker keep day job playing poker must hurtn,Negative,negative,-0.877868,0.4370255470275879
purchased film cheap sale read back dvd case assuming either way cant lose rubbish loss good bargainbr br watched itbr br normally fan christopher walken film commanded little screen presence seeming whole lot even death friend near beginning sparks action plot seems affect little eventual revenge boring undramaticbr br normally film themes grand revolution revenge able capture audience snare feeling something characters however watching film felt like seeing series confused almost random events loosely tied together towards eventual conclusionbr br point weptbr br thought film horribly painful piece viewing ever subjected scene pilot sacrifices refusing jump explosive laden truck due wanting kill civilians much tragically sad unnervingly horrible painful although quite bad emergency surgery wounded girl acting poor round script story weak action even weaker visuals bluntly visual summarise films good films bad films bad good films terriblebr br whole new level mcbain,Negative,negative,-0.999888,0.3297562599182129
saw grande ecole world premiere rotterdam film festival idea entering id idea wouldnt entered pretentious film ive seen long time tries provocative yet deep full frontal homosexual sex scenes doesnt succeed nothing another bad excuse showing naked persons big screen,Negative,negative,-0.948953,0.5597453117370605
insignificant lowbrained haha horror like thirteen dozen yet considered amusing watch right state mind special effects tacky acting atrocious screenplay seems miss couple essential paragraphs brain takes place typical quietamerican town setting every adolescent works diner coolkid high school flushes cherry bombs toilet tvguru named dr blake adorable petbrain begin quest nationwide mind controlling label independent thinkers giant cheesy brain sends waves television sets forces innocent viewers kill cool meadowvale teenrebel save world funniest thing plot never explains dr blake monstrous brain actually come obvious references towards extraterrestrial life thats meh needs background movie like really theres much bloodshed unfortunately evil brain looks like oversized sockpuppet less interesting element horror buffs taking look cast crew made movie director ed hunt writer barry pearson men made bloody birthday guilty pleasure mine plague much better movies wisely decided resign film industry familiar face cast unquestionably great david gale horror fans worship forever role reanimator girl named christine kossak provides nudityfactor shes obviously great talent exactly movies repertoire masterpiece debut credited runaway model men baby character referred one jacks girls really wonder feels career actress,Negative,positive,0.929125,0.3274722099304199
boris karloff bela lugosi made many films together whole interestingly enough karloff usually better man two real exception black cat karloff playing evil head devil cult lugosi seeking revenge destroying life usual black friday whatever motive karloff trying improve brain surgery lugosi murderous thug raven lugosi sadistic surgeon blackmails karloff assist evil plans karloff finally enough rarely negative characters totally body snatcher karloff kill lugosi lugosi trying blackmail himbr br one exception extremely sympathetic cross purposes film feel rarely audience acceptance movies mentioned karloffs dr janos rukh hard driven scientific genius sneered official scientific community theory rare form radium nigeria meteorite landed centuries ago finally gotten support well financed expedition led sir francis stevens wife lady arabella stevens walter kingsford beulah bondi another scientist frenchman named dr felix benet lugosi rukhs young wife diane frances drake friend protge stevenses named ronald drake frank lawtonbr br leave rukh warned mother violet kemble cooper possibly seeking wisdom shouldnt may end tragedy tries dismiss worried says scientific standing whether going get due creditbr br gets disaster finds substance infected remarkable radioactivity finds slowly burning tries touch people animals die hes actually built friendship understanding benet figures type radioactive fighting cocktail rukh use counter danger two things unbeatable antidote last certain amount time replenished radioactivity affected rukhs brain increasingly jealous dianes friendship ronald encouraged unfortunately sir francis lady arabella equally upset due pretend died effects radioactivity like benet several others collecting kudos wonders radium x giving man soon rukh murderous rampage destroys many lives ending ownbr br film certainly picked science extent madame curie died recently cancer got due work radium fully understood dangers radioactivity idea coming wave murders rukh cause newspapers talk curse expedition course idea cursed expedition continent africa hidden treasure buried centuries ago financed titled englishman entered archeology physics geology paging howard carter lord carnaevonbr br hand benet tries settle cause string deaths reverts idea actually demolished england whitechapel murders sir charles warren ordered retinas several dead victims photographed see last image retinas jack ripper turned got photographs retinas dead prostitutes idea die jules verne used novel brothers kip dr benet uses science fiction story finds image rukh plate benet drops plate accidentally shattersbr br film good many grounds interesting change karloff lugosi unsympathetic towards type tragic fatalism story missing films performances good well particular ms kemble cooper best remembered basil rathbones frightening sister jane murdstone david copperfield final act way bring tragedy end say hurt target,Positive,positive,0.894145,0.36049866676330566
movie thriller chase movie romance story mob tale comedy road movie well fact none br br time waiting something interesting happen still watching dull uninspiring superficial clich movie bad soundtrack even star cast acting lacking credibility hit man quirks girl whos playing hard get mob guys acting tough incapable cops yawnbr br id recommend watch backtrack want see good movie directed famous actor go see three burials melquiades estrada tommy lee jones thats call worth watching,Negative,negative,-0.999873,0.3644092082977295
awful movie full cliches perplexing scenes bad acting atrotious script hard believe guys wrote people vs larry flint man moon wrote garbage man makes list top worst movies alltime didnt guy director call realize first problem child bad enough let alone make sequel amazing piece trash films like shown children let alone released,Negative,negative,-0.999768,0.40166568756103516
st watched dir harold young rd universal mummy movie first two far final result viewers perspective story similar results hohum time storys location us egyptian priests new follower sends mummy country hopes revive kill descendants opened original tomb time mummy played lon chaneywhich doesnt make much difference hes really asked much acting character new priest becomes morguekeeper town sends mummy dirty deeds feeding tanna leaf juice girl gets way priest falls one descendents fianc wants yes immortal himhavent heard plan course thwarted townsfolk hunt mummy torchessimilar frankenstein monster burning creature ends storyhow get sequel guess youll find next one series,Negative,negative,-0.972973,0.3901646137237549
fantasy utter garbage thought michael moore cornered market ridiculous antigovernment movies one far worse anything ever wonder critics british media complain driven tabloid journalism movie leftwing loonys greatest fantasy come life big screen anyone even slightly right rabid bushbashers appalled ever got funding made im sure well syria iran pakistan north korea though hard believe days insane muslims blowing innocent commuters anyone uk thinks britain surrender war terrorism guess longer country admired standing alone nazis nearly years ago hail neville chamberlain pathetic policy appeasement,Negative,negative,-0.990531,0.33290791511535645
matrix exciting summer blockbuster visually fantastic also curiously thought provoking twilight zoneish manner general rule applies sequel doesnt match predecessor worse doesnt even compare itbr br reloaded explodes onto screen unprofessional fashion opening seconds first impression generally good one trinity shot dream immediately film nosedives disastrous first minutes gradually gains momentum enter matrix agent smith battle takes place loses speed reaches minute car chase sequence gets even worse big groanworthy twist end worst overlong zion rave scene absolutely nothing plot also pathetic excuse porn depressive dance musicbr br bullettime aspect matrix good addition reloaded overuse make seem boring first one interesting plot turns linear remotely interesting movie basically series stylish diversions prevent us realising empty really works incorrect principle bigger better appears matrix franchise quickly descended special effects drenched misfire franchises star wars saga havebr br acting standard poor part best character course goes hugo weavings agent smith one slightly interesting keanu reeves definitive neo special effects little room make much impact academy award nominee laurence fishburne reduced monotonous mentor poor dialogue carrie ann moss part action chick could done much better actress br br poor throwntogether movie matrix reloaded disappointment didnt like first one unlikely flock ones diehard fans even movies subgenre special effect bonanzas minority report matrix etc still rather poor imdb rating,Negative,negative,-0.999936,0.3709416389465332
even disney guilty cash cow disease roaring success love bug house mouse cashed herbie rides herbie goes monte carlo herbie goes bananas neither sequel capturing charm inoffensive appeal love bug back one find race driver jim douglas sidekick wheely applegate entering herbie monte carlo rally naturally things outside race start take priorities get mixed diamond robbery herbie falls love another car car stunts course pleasant easy eye would churlish really vent venom friendly piece fluff film goes nowhere fast personally see coin motivated piece work still get see herbie take bath foil baddies course dance lady life something everyone think,Negative,negative,-0.698487,0.34741902351379395
bought film ebay part lot twenty horror flicks dollar piece watching first impression probably late later began thinking linkin park posters wall everything else seemed hint dealing recent film realizing flick became unbearable torment last minutes longest movie history film refused end genre horror children case film definitely parents perverse enough want introduce offspring horror suggest would perfect kids thing really liked greg cipes much good actor kind nostalgic retro bottom part drivein doublebill,Negative,negative,-0.943221,0.36181116104125977
saw mstk version film bad movie nearly bad low imdb rating currently least movie production values apparently competent editor unlike movies truly awful primary problem movie appealing characters whatsoever main character marv pathetically morose practically asks bad stuff happens isnt smart either would figured stay away conniving girl betty even pathetic marv father nothing drunken loser highlight film heist sequence end even weakly executed excitement might added film completely missing least movie made funny mstk episode mike bots great job making fun,Negative,negative,-0.982232,0.3493320941925049
cant say enjoyed much big lebowski raising arizona felt little slighted brother enjoyable film worthy good laughs taste coens brisk twisted sense creativity dvd edition contains featurette interested find coens pretty simple directorial techniques surprised course movie best example im saying comparison wasnt worthy oscars many feel robbed maybe depends appeal br br though enjoyed coens previous work ive never fan old westerns dukes hazzard stuff show daily tnn guess thats didnt feel enthusiastic checking movie seeing revolves around southern folk south reading dont mean offend people im sure guys feel way watch movies urban areas like bronx tale live city life hard get accustomed films nature apologies aside found characters fun quirky think john turturro nailed accent perfectly seeing way talks real life find amazing tim blake nelson also good course george clooneywho assume best feigning accents judging decision chuck idea working dialogue coach developing new england accent perfect stormnaturally seems little miscast continually struggles accent performance good though also spot coen regulars like holly hunter short sweet role john goodman also screen short time steals every minute itbr br though dont normally dig country music liked title song man constant sorrow dvd also contains music video song br br overall found film entertaining original doesnt inyourface quality coens shown us past slighter effort good one still suggest check br br score,Positive,positive,0.450827,0.3138289451599121
