spoiler alertand really mean read unless prepared major plot element revealedbr br okay first ive got ta say relatively high tolerance depressing films ill watch appreciate films true life horrors war holocaust death sadness important plot hate films like steal magnolias terms endearment film built around manipulative death main character already matter well made film got major strike one main characters dies disease end though never say english subtitled versionbr br might ask blowhard hates type film watch first place would excellent point ask though hope really blowhard well found local library idea movie intended specifically export subtitles korean english japanese box printed korean well fan trying films nation ive seen films probably least different countries gave trybr br well apart obligatory death loved film hated way ended usually hate hollywoodtype miraculous endings wanted see guy saved new drug experimental surgery really bummed dieparticularly since seemed like one nicest people ive seen films long time smile infectious really wanted get girl end oh well least appreciate films message need seize moment great acting music etc satisfying ending film good enough encourage try korean cinema,Positive,negative,-0.519712,0.2962338924407959
personally dont like lot bw movies theres something magical movie br br movie starts elizabeth lane barbara stanwyck liz writes magazine column shes martha stewart connecticut course shes lying becomes problem publisher mr yardley asks play host navy sailor christmas addition mr yardley whos going alone christmas invites farm christmas party things go crazybr br since movie set new england farm movie warm holiday feeling plus characters hilarious mr yardley always shouting orders lizs friend felix always yelling catastroph things go wrong finally movie ends way christmas movie end jolly fat man laughs shouts christmas br br short matter age love movie,Positive,negative,-0.653476,0.30561399459838867
comedy morals occasionally gentle touch bitterness occurs lightness soften sarcasm irony flows till sudden one moment halt heart changes everythingbr br film marvelously written directed gem shines perfectly beautiful acting jeanlouis trintignant exquisite usual romy schneider pearl perfect glowing missed truly wonderful film,Positive,positive,0.999548,0.2981855869293213
dig funny fun amusing interesting stylish well done knowing made shoestring budget years amazing story told especially style substance music fan documentary fan must seebr br focusing brian jonestown masssacre dandy warhols years brilliant way show contrast decent band meets moderate success perseverance ability compromise genius megalomaniacal lead singer backed varied cast characters sabotage success drugs alcohol insanity know footage real people would swear incredibly well written imaginative scripted piece story compelling concise simply amazing,Positive,positive,0.995513,0.3078272342681885
eager see one favorite tv showsi saw universal trademark followed newly acquainted title theme song still impress mecomputer animation scenery like solid title namethe jetsons dimension view spaceship approaching amusement park made version splendid fantasticshortly till endi couldnt believe eyeshow lucky could forget seenjust songs tiffany theme song new arrangement headanywayi wish see spaceaged family also flintstones yogi bear graphic computer design toy story bugs lifethe best style hannabarberas opinion,Negative,neutral,0.0,0.314455509185791
sad movie tops least top movies still best action movie ever done action movies today badly done actors action directors fighting stunts properly mostly hong kong like jackie chan stunts clever wild think see likes ever start chan team go hill car chase hill town amazing end fight stunts best fight stunts ever put film end stunt sliding pole crashing glass jackie badly hurt,Positive,negative,-0.965507,0.3080742359161377
preposterous sequel stretches credibility great degree diabolical sociopath stanley kaldwell returns time infiltrating movie production novel wrote garden drownings assuming identity second unit director murderedbr br film pokes gleeful fun hollywood tongueincheek script taking shots tyrannical directors sleep actresseslooking way ladderand dislike anyone challenging complete spotlight brian krause thought dreadful overacting point satire felt incredibly forced portrays loud temperamental director doesnt like fact second unit director screenplay writer alisonplayed dahlia salemseem taking production andrew moxham paul parsons brother victim first film films dark humor time takes idea serial killer actually operating director movie set exploits worth nelson ably slides back psycho role without difficulty stanley clever ever using brains commandeer film production killing whoever order maintain full control work letting one stand waythat alison realizes stanley really alison type ambitious writer wants capture essence subjectwhat motivated stanley kill would thing led man dark path humor alison actually working man also part satire heart dark comedy thriller course get inevitable showdown alison stanley really ridiculous unbelievable conclusion regarding killers fatequite hard pill swallow unlike first film photographed sophisticated polish director pochih leong uses unnecessary techniques neededsuch shooting kinds weird angles slowmotion sepia color several instances captured videoand rather annoy instead impress sequel wasnt target much original lot humor less effective obvious,Negative,negative,-0.993008,0.35024118423461914
great offthewall romantic comedy love work pandering public taste midlife crises main character talented movie director decides make silly pg movie get hock irs excellent cast wide range humor deadpan slapstick fine writing also wry sendup movie industry metacommentary includes several excellent cuts reality movie thats made places film departs strict realism result multidimensional masterpiece wry midlife humor,Positive,positive,0.944441,0.31583714485168457
despite pretty leading lady rosita arenas one boycrushes acting direction examples making moviebr br placed southern mexico popoca aztec mummy real aztecs way made mummies waken lead characters starts making trouble mexico city suburbia first movie aztec mummy second part leading man woman want find th mummy put final resting place fireplace would first choicebr br appears bat criminal mastermindless stereotype criminal genius creates human robot idiot inside robot suit control popoca get take world final match robot mummy hilarious worst choreography ever witnessed funniest part movie made released serious mexican movie studiobr br acting awful hearing movie spanish english dubbed overacting watch movie mst comments even funnier,Negative,negative,-0.997844,0.3061556816101074
movie basks much innocence doesnt tell story big time snooze fest actors personable story trite goes nowhere think victor rasuk great charisma deserves real film real storyteller,Negative,positive,0.508625,0.2934694290161133
scifi adventure best means worst agree statement bad scifi comical bizarre pink tinting unusual special effects make favorite late late late show viewers space explorers planet mars fight strange giant amoebalike monsters strange creatures pretty coolbr br cast includes les tremayne naura hayden gerald mohr jack kruschen get comfy enjoy dont feel bad nod moment agree adding list cult classics miss,Negative,negative,-0.915076,0.30225038528442383
could considered mild spoilers anyone elses review filmbr br knew nothing could conceivably live absolute brilliance original carrie film social criticism setting gym fire carrie white victim epitomized story conveyed helplessness truly exploited must feelbr br whoever conceived rachel character rage must completely missed subtleties carrie audience genuinely share victims rage must sympathetic character true outcast victim circumstance hisher vices rachel entirely unpleasant convey sort emotional depth connection sissy spaceks carrie looks acts like right alongside attractive popular brigade ends torching like rest soul every bit corrupt whereas carrie complete innocentbr br doesnt work theres satisfaction seeing pretty children even home improvement boy getting offed movies climactic scene unnecessarily gory actual bloodshed seen burning gym br br one person particular movie audacity kill wont say youve seen original carrie sort character dies unjustlybr br least create connection carrie appropriately explained arm tattoo done rather nicely thing movie going itbr br yet another hideous scream knockoff taints reputation one compelling films ever made br br rating wasnt expecting much still horribly disappointed unsympathetic character series irritating popculture references thrown good reason ending scene pales comparison carries gravestone shocker,Negative,negative,-0.991952,0.3235347270965576
contains spoilers br br british director j lee thompson made excellent films notably ice cold alex cape fear country dance one curious offerings story set among upper classes rural scotland details strange triangular relationship sir charles ferguson eccentric aristocratic landowner sister hilary hilarys estranged husband douglas hoping reconciliation learn career army officer charles regarded low moral fibre appears accurate diagnosis condition throughout film displays attitude gloomy disillusionment world main sources emotional support seem hilary whisky bottle film ends committal upperclass lunatic asylum br br peter otoole best lawrence arabia one britains leading actors quality work uneven country dance one better films overacts frantically making charles caricature useless inbred aristocrat though auditioning part monty python upperclass twit year sketch susannah york hilary michael craig douglas rather better really outstanding acting performance film also little way coherent plot beyond tale charless inexorable downward slidebr br main problem film however neither acting plot rather theme dare speak name halfhearted hints incestuous relationship charles hilary least incestuous attraction towards part dislike douglas motivated sexual jealousy unfortunately even swinging sixties early seventies date film variously given either limit british board film censors willing allow film explicitly incestuous theme definitely offlimits american title film brotherly love used britain suggestive liking bbfc hints therefore never developed never get see motivates charles caused moral collapse resulting hollow film hole centre,Negative,negative,-0.934316,0.3268730640411377
one funniest films ever saw theater back early sadly tv times since movie released video sellers sleaziest slimiest best crooked hospital administrator great cast great movie anyone good vhs copy id love buy,Positive,positive,0.805431,0.3254985809326172
soultaker written starred vivian schilling also starred joe estevez gregg thomsen robert dzar angel deathbr br story begins introduction soultaker played joe estevez quickly learn soultakers role moviebr br next college aged young people getting ready summer festival aptly named summerfest film battle classes omnipresent throughout film girls come wealthy class guys come roughly middle lower class class roles seem play role film reason isnt really clear pertinent storybr br summerfest learn apparent class struggles zach isnt encouraged date natalie soultaker makes appearance well apparently boss angel death dzars character points die whos souls taken revealed well soultaker character conflict regarding natalie deals someone pastbr br meanwhile natalie ditched ride summerfest zach convinces ride home ride home soultaker takes active role causing wreck horribly high speedsbr br rest story surrounds soultaker collecting souls dead passengers zach natalie trying outwit return bodies continue live class character conflicts lay story really never brought forefront resolvedbr br theres attempt towards end drag drama theres lot chasing running tend really boring really acceptable wouldve nice dealt differently somehow maybe increase drama bore audiencebr br story acting decent soundtrack ok even production values goodbr br robert dzar brief screen appearances nice job angel death joe estevez ok however sometimes role acting bit flat vivian pretty decent job natalie although perhaps acting bit scenesbr br may sound odd movie definitely couldve benefited pointless nudity vivian teases us bit wasnt enoughbr br opinion pretty serious attempt making movie results worth watching dont expect perfect productionbr br,Negative,negative,-0.852275,0.3339693546295166
dismaying waste film stock needs count floyd popping every sixty seconds somehow got steve railsback susan anspach john vernon joe flaherty together set couldnt get within five miles eight kilometers actual movie boy thing suck isnt one original line thought shot effect brainless opening sequence brainless close magical ethereal susan anspach five easy pieces boring steve railsback boring john vernon boring big bug boring scary movie buttercream gang thuglife documentary br br seriously every bad movie contains explanation badness usually opening credits written directed produced one guy center action bimbo talentless know theres one one reason turkey got made dont find till last credits cooperation dozen subfunctions canadian government gratefully acknowledged br br right im watching msts take beast yucca flats get taste mouth ghod improvement,Negative,negative,-0.975761,0.300609827041626
take opening shot strange frame guess anyway two women behind closing umbrella walk upstairs talent agency go themand never seen okay come inside place piano even outside sound piano track inside la hitchcock guess clouzot already telling us subliminal manner following segment postwar society especially uses citizen kanelike song cut five pieces show lady singing traveling talent agency way first roses applause vaudeville debutbr br relentless observers less small disgusting details defeated country getting war torn tattered knees nobody ever handled small disgust better clouzot fact bad never tried sartres nausea almost everything see first minutes makes us ever slightly queasy okay okay im grossly overstating lets settle general feel lot film look carefully fact even see one cops picking nose many films anyone ever done loud nose blowing bit front photographer lesbian main cop notice literally blink eye raise eyebrowbr br point almost feverish immersion contiguity seemingly smell practically every scene well see feel br br aspects movie others covered lot detail forget mystery ultimate mcguffin clouzot interested real killer two women coming rain first seconds film never seen beginning end wanted follow bunch people around even particularly interesting ones say look womans twitch mans hitching pants insignificance years years tina turner singing dont need another hero br br even forced levity ending bleakly done dilapidated part paris rather chilly bare walled apartment couples love see say must two three million like throughout city working fingers day little love nightbr br short step wages fear ultimate despair br br dont even know make films like anymore us matter didnt even know much france much less relentless detail gesture makes even neorealists italy look like bad psychologists guess makes clouzot kind rosselini speed br br enjoyable nonsense movie flaw seems pointed another viewer lead woman somehow quite right everybody else film perfectly cast,Positive,negative,-0.971307,0.3129849433898926
br br spoilersbr br im going kind film people including directors get quite upset reviewers speak mind sobr br nice car accident opening credits look good thats everything else bites big one acting appalling script embarrassing special effects look like done school children cheap computers film serious bowling shoe tendenciesbr br horror film scary supposed thinking mans horror film well succeeded level kept thinking end film awfully long way away may actually ironic look bad horror films im missing point somehow doubt itbr br complete car phone warehouse film could recommend anyone pain say eagerly await resurrection british horrorbr br dont agree review fine opinion im sure someone love directors mum instance,Negative,negative,-0.842058,0.32634663581848145
maybe im alone crap show im sorry lured found lil bill oreilly idea came show months later honestly since lost appeal gave show fair shot spike tries hard make something hes say tries human fox didnt even bother hide strings took box came sketches try hard isnt funny writers struggling write material notalent host much good tv waste time show foxfox good times need get fing act together come something original instead trying another metoo network,Negative,negative,-0.994627,0.2914426326751709
would say film disturbing brutality depicted sick way like psychosis minutes time cruel introspection human behavior scenes ferocious starting butchery horse ending brutal sex scene kitchen every emotion exploited extreme frustration butcher love daughter almost incestuous rage finds abused every feeling natural wrong film delivers truth human nature honest brutal way message film ones life change second consequence ones behavior primitive emotions powerful determine ones acting id loved unique manner filming simplicity brutality accompanied silence inner thoughts pierce,Positive,positive,0.99023,0.2989532947540283
true feelgood movie full genuine sweetness admirable people although premise requires significant suspension disbelief worth trouble director writers actors truly convey feels like love,Positive,positive,0.686588,0.2955665588378906
tip read heres howbr br copy paste notepad word go startall programsaccessoriesaccessabiltynarratorbr br testicles ironedbr br jonathan ross started career show call last resort days first resort host anything anything tv award shows half time nominations comic relief chat shows quiz shows game shows charity shows brighton wits end think find salvation wireless lisping twang good old jr hits like freight train going none stop texas downtown ny lost hour trying make upbr br show fnwjrbr br normal chat show format jr host house band concisest four gay men ha ha ha ow aching sides season one andy davis left fired give way rosss egobr br ross less use guests props really dont hear speak ball ill take home attitude also see bigger guest willing lie suck get big boys like weak kid school hangs round bullybr br however small reality tv star comes hell happily humiliate asking personal questions past telling lack talent get laughs sometimes estimate popularity guest say something belittle audience act shocked quickly turn start making fall guy best example life mars star john simm came said someone like get work ok looking hollywood goodlooking bare mind hugh jackman halle berry green room really trying suck even couch audience acted shock ross quickly said im bit light headed wearing corset dont know im saying dont low forms tv life hell dig four gay men piano jokes date fashionbr br much different story hollywood alister big tv star comes show hell tell stories humor actor explains support band jonathon ross say something like wow well ever go see band try look interested support band make feel though wanted underline message please like probably one people cheered band top audience ross fans hooked every bad old joke bulling really makes poor showbr br better watching us chat shows instead scripted anywhere near hard watch,Negative,negative,-0.847772,0.30403780937194824
im usually wary movies hovering around mark imdb id like think people know talking know like guess trick reviewing take approach hey liked types movies like would give higher score give since dont like types movies people judge differently basing value acting perhaps story directing anyway landing plane rented movie hadnt time watch morning didbr br wow see movie personally interested paranormalhave read bit near death experiences automatically hooked unsure comments saying quality cast wasted disagree acting superb think time didnt mind julia roberts good see kiefer sutherland currently time review serving jail sentence dui kevin bacon sporting interesting hair stylebr br overall liked direction atmosphere acting story line particularly idea karma quote nelson wright everything matters truebr br,Positive,negative,-0.445125,0.3070652484893799
caught movie tcm understand george murphy went politics best mgm could serve slowmoving attempt make real filmnoir effort come featured two favouritebr br players eve arden completely wasted dean stockwellthe best actor film really hit leading lady frances gifford went minutes seemed longer without changing expression faceher fainting scene comical john hodiak played role ok script let rest cast badly gave stars mainly photography would first half program double features go,Negative,negative,-0.991237,0.29689979553222656
read somewhere fairly panning review something liveaction mecha anime think theyre right lines first watched movie young ive dying see finally recently memories came flooding back dont think taken seriously bit good old almostatvmovie fun set backdrop fairly dark future although point isnt stressed much admired movie dialogue didnt sound generic clichs predictable lines good fun maybe time hasnt kind little movie still find appreciation means perfect entertaining doesnt try anything let nerds comicstoreguys worry technicalities cares see make decision noone elses opinion matters,Positive,negative,-0.591793,0.3015451431274414
movie wonderful separates scifi fact alien features face eyes anything yet cant killed especially like idea film doesnt take place days takes place one night lasting supposedly past midnightits also scary blob gets cant get youre stuck dissolves flesh slowly devours body time favorite scifi film sometimes considered quintessential one see rocketed steve mcqueen stardom catchy theme song go wrong,Positive,negative,-0.686659,0.31514930725097656
film one films bad get annoyed mad seems arse yet completely funny nothing interest film real jokes make amused watch minutes turn bought budget dvd im glad worth much isnt even one films thats bad watch friends getting drunkhigh good giggle didnt hate like hate films rather boring worth investing time inbr br people voted votes film must connected somehow imagine anyone actually liking film small children passing time,Negative,negative,-0.890007,0.3048985004425049
huge charlton heston fan without doubt one greatest actors time thinking made movie normally made bad movie could blame screenwriter director case suckiness movie fault proves even heston make shakespeare story interesting wasted half hours life snooze fest ill never get time back far worst heston movie ive ever seen shakespeare fan maybe youll find movie entertaining youre dont waste time youll regret long run,Negative,negative,-0.983026,0.29356980323791504
loved movie jack black kyle gass probably made one best comedies since smoke movie something everyone rock drugs satan could someone want suggest movie anyone wants sit back forget trouble world good laugh even movie well theaters sure become cult classic suggest anyone going see movie pick ds first album lot jokes made funnier heard songs jbs obsession sasquatch epic battle devilthe movie still guarantied laughs even heard music songs great cant pass,Positive,negative,-0.728553,0.3040614128112793
surface lies simply awful movie whatbr br viewers justifiably commented storm sequences plain ridiculous chopping already sodden firewood pouring rain thats smart menace foreboding sexual tension read dull contrived dull contrived dull overly contrivedbr br want say thank god mia saras shower scene retrospect think producers film seen completed mess realised put something make half way worthwhile becomes yet another contrivance favour give miss,Negative,negative,-0.999404,0.29682111740112305
australian post office ever needed promotional film recruitment itthis one movies whos heart right place watch mirandas performance touching shows aspect australia unimagined many europeans cold wet bleak like anywhere else like anywhere else important people surrounds characters movie warm welcoming make prospect career move dead letter office thought considered miranda gone bigger movies hope always keeps thought inside one,Positive,positive,0.878014,0.3011343479156494
oneround jack sander called hes carnival boxer fights man audience last one round win prizea popular way draw customers traveling shows long ago jack love ticket girl mabel though head quickly turned bob corby enters ring try chances jack one fight knows bob champ hes able beat jackthough takes work result bob asks jack become sparring partner give carnival circuit later jack improves much becomes legitimate boxer slowly works way rankings hes nearly ready take champbr br meantime champ mabel start running around behind jacks backeven though mabel married jack final fight occurs jack bob personal jack ready kill good enough rise justifiable rage bob help hinder performance tune seebr br film directed alfred hitchcock today sort film seems strange director known mysterysuspense films back hitchcock fixed genre directed wrote film fact many ways film indicative hitchcocks silent style somewhat similar plot came one next silents manxman also starring carl brisson wronged husband seems lot like standard boxing film day radical departure great directoreven rather formulaic endingbr br overall bit predictable ian hunter playing boxing champ seems silly film works well far perfect silent well worth seeing packs nice punch,Positive,negative,-0.809653,0.32149744033813477
